No.,Time,Source,Destination,Protocol,Length,RTT,Info
2,0.000113,10.19.6.231,31.13.79.53,TCP,66,0.000113,55180  >  443 [ACK] Seq=1 Ack=46 Win=2047 Len=0 TSval=1054090449 TSecr=216036036
20,1.412427,31.13.79.18,10.19.6.231,TCP,66,0.002631,443  >  55010 [ACK] Seq=1 Ack=33 Win=231 Len=0 TSval=216036184 TSecr=1054091854
23,1.588629,10.19.6.231,31.13.79.18,TCP,66,0.000114,55010  >  443 [ACK] Seq=33 Ack=29 Win=2047 Len=0 TSval=1054092031 TSecr=216036202
44,3.729636,172.217.31.196,10.19.6.231,TCP,66,0.002772,443  >  55284 [ACK] Seq=1 Ack=195 Win=239 Len=0 TSval=216036416 TSecr=1054094165
45,3.729903,172.217.31.196,10.19.6.231,TCP,66,0.003038,443  >  55284 [ACK] Seq=1 Ack=234 Win=239 Len=0 TSval=216036416 TSecr=1054094165
47,3.781154,10.19.6.231,172.217.31.196,TCP,66,0.000096,55284  >  443 [ACK] Seq=234 Ack=40 Win=2047 Len=0 TSval=1054094218 TSecr=216036421
49,3.848743,10.19.6.231,172.217.31.196,TCP,66,0.000079,55284  >  443 [ACK] Seq=234 Ack=246 Win=2044 Len=0 TSval=1054094284 TSecr=216036428
51,3.849005,10.19.6.231,172.217.31.196,TCP,66,0.00005,55284  >  443 [ACK] Seq=234 Ack=748 Win=2040 Len=0 TSval=1054094284 TSecr=216036428
53,3.851413,10.19.6.231,172.217.31.196,TCP,66,0.000062,55284  >  443 [ACK] Seq=234 Ack=780 Win=2039 Len=0 TSval=1054094286 TSecr=216036428
55,3.852552,10.19.6.231,172.217.31.196,TCP,66,0.000064,55284  >  443 [ACK] Seq=234 Ack=811 Win=2047 Len=0 TSval=1054094287 TSecr=216036428
57,3.85269,10.19.6.231,172.217.31.196,TCP,66,0.000039,55284  >  443 [ACK] Seq=234 Ack=850 Win=2047 Len=0 TSval=1054094287 TSecr=216036428
59,3.854361,172.217.31.196,10.19.6.231,TCP,66,0.000998,443  >  55284 [ACK] Seq=850 Ack=273 Win=239 Len=0 TSval=216036428 TSecr=1054094287
61,3.8737,172.217.31.196,10.19.6.231,TCP,66,0.000932,443  >  55284 [ACK] Seq=850 Ack=467 Win=260 Len=0 TSval=216036430 TSecr=1054094306
63,3.981938,10.19.6.231,172.217.31.196,TCP,66,0.000092,55284  >  443 [ACK] Seq=467 Ack=1057 Win=2044 Len=0 TSval=1054094413 TSecr=216036441
65,3.982184,10.19.6.231,172.217.31.196,TCP,66,0.000067,55284  >  443 [ACK] Seq=467 Ack=1557 Win=2040 Len=0 TSval=1054094413 TSecr=216036441
68,3.982728,10.19.6.231,172.217.31.196,TCP,66,0.000069,55284  >  443 [ACK] Seq=467 Ack=1589 Win=2039 Len=0 TSval=1054094413 TSecr=216036441
69,3.982728,10.19.6.231,172.217.31.196,TCP,66,0.000066,55284  >  443 [ACK] Seq=467 Ack=1620 Win=2039 Len=0 TSval=1054094413 TSecr=216036441
71,4.033189,10.19.6.231,172.217.31.196,TCP,66,0.000101,55284  >  443 [ACK] Seq=467 Ack=1659 Win=2047 Len=0 TSval=1054094464 TSecr=216036446
73,4.034418,172.217.31.196,10.19.6.231,TCP,66,0.000934,443  >  55284 [ACK] Seq=1659 Ack=506 Win=260 Len=0 TSval=216036446 TSecr=1054094464
75,4.128078,172.217.31.196,10.19.6.231,TCP,66,0.001196,443  >  55284 [ACK] Seq=1659 Ack=701 Win=282 Len=0 TSval=216036456 TSecr=1054094557
77,4.233248,10.19.6.231,172.217.31.196,TCP,66,0.000072,55284  >  443 [ACK] Seq=701 Ack=1865 Win=2044 Len=0 TSval=1054094662 TSecr=216036466
79,4.233669,10.19.6.231,172.217.31.196,TCP,66,0.000053,55284  >  443 [ACK] Seq=701 Ack=2321 Win=2040 Len=0 TSval=1054094662 TSecr=216036466
81,4.237702,10.19.6.231,172.217.31.196,TCP,66,0.000074,55284  >  443 [ACK] Seq=701 Ack=2423 Win=2046 Len=0 TSval=1054094665 TSecr=216036466
83,4.239709,172.217.31.196,10.19.6.231,TCP,66,0.001137,443  >  55284 [ACK] Seq=2423 Ack=740 Win=282 Len=0 TSval=216036467 TSecr=1054094666
85,4.341169,172.217.31.196,10.19.6.231,TCP,66,0.001111,443  >  55284 [ACK] Seq=2423 Ack=942 Win=303 Len=0 TSval=216036477 TSecr=1054094766
89,4.371928,118.214.44.253,10.19.6.231,TCP,74,0.001153,"443  >  55328 [SYN, ACK] Seq=0 Ack=1 Win=18328 Len=0 MSS=9176 SACK_PERM=1 TSval=216036480 TSecr=1054094795 WS=128"
90,4.372009,10.19.6.231,118.214.44.253,TCP,66,0.000081,55328  >  443 [ACK] Seq=1 Ack=1 Win=131712 Len=0 TSval=1054094796 TSecr=216036480
92,4.373943,118.214.44.253,10.19.6.231,TCP,66,0.00121,443  >  55328 [ACK] Seq=1 Ack=600 Win=19584 Len=0 TSval=216036480 TSecr=1054094796
94,4.453864,10.19.6.231,172.217.31.196,TCP,66,0.00012,55284  >  443 [ACK] Seq=942 Ack=2629 Win=2044 Len=0 TSval=1054094876 TSecr=216036488
96,4.454105,10.19.6.231,172.217.31.196,TCP,66,0.00005,55284  >  443 [ACK] Seq=942 Ack=3008 Win=2038 Len=0 TSval=1054094876 TSecr=216036488
98,4.456055,10.19.6.231,172.217.31.196,TCP,66,0.000085,55284  >  443 [ACK] Seq=942 Ack=3040 Win=2047 Len=0 TSval=1054094878 TSecr=216036488
101,4.456307,10.19.6.231,172.217.31.196,TCP,66,0.000119,55284  >  443 [ACK] Seq=942 Ack=3071 Win=2047 Len=0 TSval=1054094878 TSecr=216036488
102,4.456308,10.19.6.231,172.217.31.196,TCP,66,0.000117,55284  >  443 [ACK] Seq=942 Ack=3110 Win=2046 Len=0 TSval=1054094878 TSecr=216036488
104,4.458605,172.217.31.196,10.19.6.231,TCP,66,0.000966,443  >  55284 [ACK] Seq=3110 Ack=981 Win=303 Len=0 TSval=216036489 TSecr=1054094879
106,4.656484,10.19.6.231,118.214.44.253,TCP,66,0.000073,55328  >  443 [ACK] Seq=600 Ack=261 Win=131456 Len=0 TSval=1054095076 TSecr=216036508
109,4.660389,118.214.44.253,10.19.6.231,TCP,66,0.001454,443  >  55328 [ACK] Seq=261 Ack=680 Win=19584 Len=0 TSval=216036509 TSecr=1054095078
110,4.660763,118.214.44.253,10.19.6.231,TCP,66,0.001272,443  >  55328 [ACK] Seq=261 Ack=766 Win=19584 Len=0 TSval=216036509 TSecr=1054095078
113,4.662125,118.214.44.253,10.19.6.231,TCP,66,0.001335,443  >  55328 [ACK] Seq=261 Ack=2214 Win=22528 Len=0 TSval=216036509 TSecr=1054095079
114,4.662462,118.214.44.253,10.19.6.231,TCP,66,0.00167,443  >  55328 [ACK] Seq=261 Ack=3506 Win=25344 Len=0 TSval=216036509 TSecr=1054095079
116,4.696618,10.19.6.231,31.13.79.18,TCP,66,0.000098,54972  >  443 [ACK] Seq=1 Ack=167 Win=2045 Len=0 TSval=1054095113 TSecr=216036512
121,4.714377,10.19.6.231,118.214.44.253,TCP,66,0.00014,55328  >  443 [ACK] Seq=3506 Ack=532 Win=131200 Len=0 TSval=1054095130 TSecr=216036514
122,4.714377,10.19.6.231,118.214.44.253,TCP,66,0.000138,55328  >  443 [ACK] Seq=3506 Ack=602 Win=131136 Len=0 TSval=1054095130 TSecr=216036514
124,4.715998,118.214.44.253,10.19.6.231,TCP,66,0.001306,443  >  55328 [ACK] Seq=602 Ack=3537 Win=25344 Len=0 TSval=216036514 TSecr=1054095130
129,4.722045,10.19.6.231,118.214.44.253,TCP,66,0.000129,55328  >  443 [ACK] Seq=3537 Ack=1648 Win=130112 Len=0 TSval=1054095136 TSecr=216036515
130,4.722096,10.19.6.231,118.214.44.253,TCP,66,0.000176,55328  >  443 [ACK] Seq=3537 Ack=3096 Win=128640 Len=0 TSval=1054095136 TSecr=216036515
131,4.722096,10.19.6.231,118.214.44.253,TCP,66,0.000073,55328  >  443 [ACK] Seq=3537 Ack=3740 Win=128000 Len=0 TSval=1054095136 TSecr=216036515
133,4.723657,31.13.79.18,10.19.6.231,TCP,66,0.002171,443  >  54972 [ACK] Seq=167 Ack=269 Win=665 Len=0 TSval=216036515 TSecr=1054095136
136,4.735352,10.19.6.231,118.214.44.253,TCP,66,0.001407,55328  >  443 [ACK] Seq=3537 Ack=6636 Win=129600 Len=0 TSval=1054095148 TSecr=216036516
139,4.748455,10.19.6.231,118.214.44.253,TCP,66,0.001036,55328  >  443 [ACK] Seq=3537 Ack=9532 Win=128128 Len=0 TSval=1054095160 TSecr=216036517
143,4.761575,10.19.6.231,118.214.44.253,TCP,66,0.00062,55328  >  443 [ACK] Seq=3537 Ack=12428 Win=128128 Len=0 TSval=1054095172 TSecr=216036519
146,4.771622,10.19.6.231,31.13.79.18,TCP,66,0.000137,54972  >  443 [ACK] Seq=269 Ack=202 Win=2047 Len=0 TSval=1054095182 TSecr=216036520
149,4.774555,10.19.6.231,118.214.44.253,TCP,66,0.000055,55328  >  443 [ACK] Seq=3537 Ack=15324 Win=128128 Len=0 TSval=1054095184 TSecr=216036520
153,4.789791,10.19.6.231,118.214.44.253,TCP,66,0.000074,55328  >  443 [ACK] Seq=3537 Ack=18220 Win=128128 Len=0 TSval=1054095199 TSecr=216036522
159,4.801505,10.19.6.231,118.214.44.253,TCP,66,0.000096,55328  >  443 [ACK] Seq=3537 Ack=21116 Win=129600 Len=0 TSval=1054095210 TSecr=216036523
160,4.801562,10.19.6.231,118.214.44.253,TCP,66,0.000146,55328  >  443 [ACK] Seq=3537 Ack=22613 Win=128064 Len=0 TSval=1054095210 TSecr=216036523
173,4.814952,10.19.6.231,118.214.44.253,TCP,66,0.000106,55328  >  443 [ACK] Seq=3537 Ack=24061 Win=129600 Len=0 TSval=1054095224 TSecr=216036524
174,4.814952,10.19.6.231,118.214.44.253,TCP,66,0.0001,55328  >  443 [ACK] Seq=3537 Ack=25509 Win=128128 Len=0 TSval=1054095224 TSecr=216036524
177,4.819748,10.19.6.231,118.214.44.253,TCP,66,0.000086,55328  >  443 [ACK] Seq=3537 Ack=26908 Win=129664 Len=0 TSval=1054095228 TSecr=216036525
180,4.828556,10.19.6.231,118.214.44.253,TCP,66,0.000065,55328  >  443 [ACK] Seq=3537 Ack=29804 Win=128128 Len=0 TSval=1054095236 TSecr=216036525
184,4.835893,10.19.6.231,118.214.44.253,TCP,66,0.000077,55328  >  443 [ACK] Seq=3537 Ack=32700 Win=129600 Len=0 TSval=1054095243 TSecr=216036526
186,4.842464,10.19.6.231,118.214.44.253,TCP,66,0.000086,55328  >  443 [ACK] Seq=3537 Ack=33675 Win=130048 Len=0 TSval=1054095249 TSecr=216036527
196,5.181511,118.214.44.253,10.19.6.231,TCP,66,0.001422,443  >  55328 [ACK] Seq=33675 Ack=6285 Win=31232 Len=0 TSval=216036561 TSecr=1054095585
209,5.240485,10.19.6.231,118.214.44.253,TCP,66,0.000122,55328  >  443 [ACK] Seq=6285 Ack=36571 Win=129600 Len=0 TSval=1054095643 TSecr=216036567
210,5.240485,10.19.6.231,118.214.44.253,TCP,66,0.000118,55328  >  443 [ACK] Seq=6285 Ack=37859 Win=128320 Len=0 TSval=1054095643 TSecr=216036567
212,5.242545,10.19.6.231,118.214.44.253,TCP,66,0.000126,55328  >  443 [ACK] Seq=6285 Ack=39307 Win=131072 Len=0 TSval=1054095645 TSecr=216036567
214,5.242888,10.19.6.231,118.214.44.253,TCP,66,0.00005,55328  >  443 [ACK] Seq=6285 Ack=40755 Win=129600 Len=0 TSval=1054095645 TSecr=216036567
216,5.247876,10.19.6.231,118.214.44.253,TCP,66,0.000096,55328  >  443 [ACK] Seq=6285 Ack=42203 Win=129600 Len=0 TSval=1054095650 TSecr=216036567
218,5.248147,10.19.6.231,118.214.44.253,TCP,66,0.000055,55328  >  443 [ACK] Seq=6285 Ack=43651 Win=129600 Len=0 TSval=1054095650 TSecr=216036567
221,5.253427,10.19.6.231,118.214.44.253,TCP,66,0.000065,55328  >  443 [ACK] Seq=6285 Ack=46547 Win=128128 Len=0 TSval=1054095655 TSecr=216036568
224,5.257999,10.19.6.231,118.214.44.253,TCP,66,0.000075,55328  >  443 [ACK] Seq=6285 Ack=47995 Win=129600 Len=0 TSval=1054095660 TSecr=216036568
226,5.258508,10.19.6.231,118.214.44.253,TCP,66,0.000064,55328  >  443 [ACK] Seq=6285 Ack=49443 Win=128128 Len=0 TSval=1054095660 TSecr=216036568
230,5.263501,10.19.6.231,118.214.44.253,TCP,66,0.000055,55328  >  443 [ACK] Seq=6285 Ack=52339 Win=128128 Len=0 TSval=1054095665 TSecr=216036569
233,5.268785,10.19.6.231,118.214.44.253,TCP,66,0.000074,55328  >  443 [ACK] Seq=6285 Ack=55235 Win=125248 Len=0 TSval=1054095670 TSecr=216036570
238,5.274076,10.19.6.231,118.214.44.253,TCP,66,0.000067,55328  >  443 [ACK] Seq=6285 Ack=58131 Win=129600 Len=0 TSval=1054095675 TSecr=216036570
240,5.278762,10.19.6.231,118.214.44.253,TCP,66,0.000075,55328  >  443 [ACK] Seq=6285 Ack=59579 Win=129600 Len=0 TSval=1054095680 TSecr=216036571
242,5.279172,10.19.6.231,118.214.44.253,TCP,66,0.000048,55328  >  443 [ACK] Seq=6285 Ack=61027 Win=128128 Len=0 TSval=1054095680 TSecr=216036571
244,5.283979,10.19.6.231,118.214.44.253,TCP,66,0.000073,55328  >  443 [ACK] Seq=6285 Ack=62475 Win=126720 Len=0 TSval=1054095685 TSecr=216036571
246,5.284439,10.19.6.231,118.214.44.253,TCP,66,0.000062,55328  >  443 [ACK] Seq=6285 Ack=63923 Win=125248 Len=0 TSval=1054095685 TSecr=216036571
250,5.289954,10.19.6.231,118.214.44.253,TCP,66,0.000089,55328  >  443 [ACK] Seq=6285 Ack=66748 Win=128192 Len=0 TSval=1054095689 TSecr=216036572
407,5.661914,172.217.160.142,10.19.6.231,TCP,66,0.001561,443  >  55260 [ACK] Seq=1 Ack=124 Win=334 Len=0 TSval=216036609 TSecr=1054096057
408,5.661918,172.217.160.142,10.19.6.231,TCP,66,0.001482,443  >  55260 [ACK] Seq=1 Ack=163 Win=334 Len=0 TSval=216036609 TSecr=1054096057
415,5.663404,172.217.160.142,10.19.6.231,TCP,66,0.00292,443  >  55260 [ACK] Seq=1 Ack=1611 Win=357 Len=0 TSval=216036609 TSecr=1054096057
416,5.663405,172.217.160.142,10.19.6.231,TCP,66,0.00292,443  >  55260 [ACK] Seq=1 Ack=1996 Win=379 Len=0 TSval=216036609 TSecr=1054096057
531,5.72242,10.19.6.231,172.217.160.142,TCP,66,0.000074,55260  >  443 [ACK] Seq=1996 Ack=40 Win=2047 Len=0 TSval=1054096116 TSecr=216036615
833,5.799167,10.19.6.231,31.13.79.18,TCP,66,0.000078,55010  >  443 [ACK] Seq=33 Ack=680 Win=2037 Len=0 TSval=1054096191 TSecr=216036622
841,5.860908,10.19.6.231,172.217.160.142,TCP,66,0.000091,55260  >  443 [ACK] Seq=1996 Ack=123 Win=2046 Len=0 TSval=1054096252 TSecr=216036629
843,5.861158,10.19.6.231,172.217.160.142,TCP,66,0.00005,55260  >  443 [ACK] Seq=1996 Ack=844 Win=2036 Len=0 TSval=1054096252 TSecr=216036629
845,5.862952,10.19.6.231,172.217.160.142,TCP,66,0.000078,55260  >  443 [ACK] Seq=1996 Ack=1082 Win=2044 Len=0 TSval=1054096254 TSecr=216036629
847,5.863242,10.19.6.231,172.217.160.142,TCP,66,0.000063,55260  >  443 [ACK] Seq=1996 Ack=1366 Win=2043 Len=0 TSval=1054096254 TSecr=216036629
849,5.86389,10.19.6.231,172.217.160.142,TCP,66,0.000086,55260  >  443 [ACK] Seq=1996 Ack=1405 Win=2047 Len=0 TSval=1054096254 TSecr=216036629
851,5.867881,172.217.160.142,10.19.6.231,TCP,66,0.001116,443  >  55260 [ACK] Seq=1405 Ack=2035 Win=379 Len=0 TSval=216036629 TSecr=1054096257
862,6.096078,13.227.178.155,10.19.6.231,TCP,66,0.001181,443  >  55294 [ACK] Seq=1 Ack=522 Win=169 Len=0 TSval=216036652 TSecr=1054096484
872,6.152032,10.19.6.231,13.227.178.155,TCP,66,0.000113,55294  >  443 [ACK] Seq=522 Ack=414 Win=2043 Len=0 TSval=1054096540 TSecr=216036658
885,6.880924,103.254.155.35,10.19.6.231,TCP,74,0.020575,"443  >  55329 [SYN, ACK] Seq=0 Ack=1 Win=18328 Len=0 MSS=9176 SACK_PERM=1 TSval=216036729 TSecr=1054097245 WS=128"
886,6.881003,10.19.6.231,103.254.155.35,TCP,66,0.000079,55329  >  443 [ACK] Seq=1 Ack=1 Win=131712 Len=0 TSval=1054097265 TSecr=216036729
888,6.901665,104.81.18.27,10.19.6.231,TCP,74,0.027715,"443  >  55330 [SYN, ACK] Seq=0 Ack=1 Win=18328 Len=0 MSS=9176 SACK_PERM=1 TSval=216036731 TSecr=1054097258 WS=128"
889,6.901669,103.254.155.35,10.19.6.231,TCP,66,0.020352,443  >  55329 [ACK] Seq=1 Ack=556 Win=19456 Len=0 TSval=216036731 TSecr=1054097265
890,6.901762,10.19.6.231,104.81.18.27,TCP,66,0.000097,55330  >  443 [ACK] Seq=1 Ack=1 Win=131712 Len=0 TSval=1054097285 TSecr=216036731
892,6.904484,104.81.18.27,10.19.6.231,TCP,66,0.00235,443  >  55330 [ACK] Seq=1 Ack=620 Win=19584 Len=0 TSval=216036733 TSecr=1054097285
895,7.084215,104.81.18.27,10.19.6.231,TCP,74,0.008162,"443  >  55331 [SYN, ACK] Seq=0 Ack=1 Win=18328 Len=0 MSS=9176 SACK_PERM=1 TSval=216036751 TSecr=1054097457 WS=128"
896,7.084228,118.214.44.253,10.19.6.231,TCP,66,0.002819,443  >  55292 [ACK] Seq=1 Ack=690 Win=210 Len=0 TSval=216036751 TSecr=1054097462
897,7.084477,10.19.6.231,104.81.18.27,TCP,66,0.000262,55331  >  443 [ACK] Seq=1 Ack=1 Win=131712 Len=0 TSval=1054097464 TSecr=216036751
899,7.086271,104.81.18.27,10.19.6.231,TCP,66,0.001224,443  >  55331 [ACK] Seq=1 Ack=600 Win=19584 Len=0 TSval=216036751 TSecr=1054097464
901,7.137091,10.19.6.231,118.214.44.253,TCP,66,0.00029,55292  >  443 [ACK] Seq=690 Ack=406 Win=2041 Len=0 TSval=1054097514 TSecr=216036756
903,7.14485,118.214.44.253,10.19.6.231,TCP,66,0.001263,443  >  55292 [ACK] Seq=406 Ack=1422 Win=222 Len=0 TSval=216036757 TSecr=1054097520
908,7.181796,10.19.6.231,104.81.18.27,TCP,66,0.000109,55330  >  443 [ACK] Seq=620 Ack=261 Win=131456 Len=0 TSval=1054097557 TSecr=216036761
912,7.184711,104.81.18.27,10.19.6.231,TCP,66,0.001425,443  >  55330 [ACK] Seq=261 Ack=700 Win=19584 Len=0 TSval=216036761 TSecr=1054097558
913,7.184714,104.81.18.27,10.19.6.231,TCP,66,0.001192,443  >  55330 [ACK] Seq=261 Ack=786 Win=19584 Len=0 TSval=216036761 TSecr=1054097558
914,7.185024,104.81.18.27,10.19.6.231,TCP,66,0.001161,443  >  55330 [ACK] Seq=261 Ack=1344 Win=20864 Len=0 TSval=216036761 TSecr=1054097558
916,7.198061,10.19.6.231,118.214.44.253,TCP,66,0.000109,55292  >  443 [ACK] Seq=1422 Ack=1048 Win=2037 Len=0 TSval=1054097572 TSecr=216036762
918,7.227773,10.19.6.231,103.254.155.35,TCP,66,0.000087,55329  >  443 [ACK] Seq=556 Ack=157 Win=131584 Len=0 TSval=1054097601 TSecr=216036765
921,7.231786,103.254.155.35,10.19.6.231,TCP,66,0.001059,443  >  55329 [ACK] Seq=157 Ack=607 Win=19456 Len=0 TSval=216036766 TSecr=1054097603
922,7.232056,103.254.155.35,10.19.6.231,TCP,66,0.001088,443  >  55329 [ACK] Seq=157 Ack=1080 Win=20608 Len=0 TSval=216036766 TSecr=1054097603
924,7.236681,10.19.6.231,104.81.18.27,TCP,66,0.000144,55330  >  443 [ACK] Seq=1344 Ack=548 Win=131200 Len=0 TSval=1054097608 TSecr=216036766
926,7.236894,10.19.6.231,104.81.18.27,TCP,66,0.00005,55330  >  443 [ACK] Seq=1344 Ack=618 Win=131136 Len=0 TSval=1054097608 TSecr=216036766
928,7.2389,104.81.18.27,10.19.6.231,TCP,66,0.000938,443  >  55330 [ACK] Seq=618 Ack=1375 Win=20864 Len=0 TSval=216036767 TSecr=1054097609
930,7.25722,103.254.155.35,10.19.6.231,TCP,74,0.003041,"443  >  55332 [SYN, ACK] Seq=0 Ack=1 Win=18328 Len=0 MSS=9176 SACK_PERM=1 TSval=216036768 TSecr=1054097625 WS=128"
931,7.257308,10.19.6.231,103.254.155.35,TCP,66,0.000088,55332  >  443 [ACK] Seq=1 Ack=1 Win=131712 Len=0 TSval=1054097628 TSecr=216036768
933,7.258925,103.254.155.35,10.19.6.231,TCP,66,0.001378,443  >  55332 [ACK] Seq=1 Ack=530 Win=19456 Len=0 TSval=216036769 TSecr=1054097628
937,7.292566,10.19.6.231,104.81.18.27,TCP,66,0.000065,55330  >  443 [ACK] Seq=1375 Ack=2710 Win=129024 Len=0 TSval=1054097661 TSecr=216036772
938,7.292567,10.19.6.231,104.81.18.27,TCP,66,0.000063,55330  >  443 [ACK] Seq=1375 Ack=2817 Win=128896 Len=0 TSval=1054097661 TSecr=216036772
940,7.322774,10.19.6.231,103.254.155.35,TCP,66,0.000083,55329  >  443 [ACK] Seq=1080 Ack=1413 Win=130304 Len=0 TSval=1054097691 TSecr=216036774
942,7.36522,10.19.6.231,104.81.18.27,TCP,66,0.000133,55331  >  443 [ACK] Seq=600 Ack=261 Win=131456 Len=0 TSval=1054097733 TSecr=216036779
946,7.372243,104.81.18.27,10.19.6.231,TCP,66,0.003665,443  >  55331 [ACK] Seq=261 Ack=680 Win=19584 Len=0 TSval=216036780 TSecr=1054097736
947,7.372251,104.81.18.27,10.19.6.231,TCP,66,0.003295,443  >  55331 [ACK] Seq=261 Ack=766 Win=19584 Len=0 TSval=216036780 TSecr=1054097736
948,7.372658,104.81.18.27,10.19.6.231,TCP,66,0.003202,443  >  55331 [ACK] Seq=261 Ack=1200 Win=20736 Len=0 TSval=216036780 TSecr=1054097736
950,7.428546,10.19.6.231,104.81.18.27,TCP,66,0.000083,55331  >  443 [ACK] Seq=1200 Ack=532 Win=131200 Len=0 TSval=1054097794 TSecr=216036786
952,7.429488,10.19.6.231,104.81.18.27,TCP,66,0.000047,55331  >  443 [ACK] Seq=1200 Ack=602 Win=131136 Len=0 TSval=1054097794 TSecr=216036786
954,7.430677,104.81.18.27,10.19.6.231,TCP,66,0.00105,443  >  55331 [ACK] Seq=602 Ack=1231 Win=20736 Len=0 TSval=216036786 TSecr=1054097795
956,7.433099,10.19.6.231,104.81.18.27,TCP,66,0.000098,55331  >  443 [ACK] Seq=1231 Ack=1040 Win=130688 Len=0 TSval=1054097798 TSecr=216036786
959,7.477971,104.81.18.27,10.19.6.231,TCP,66,0.032248,443  >  55331 [ACK] Seq=1040 Ack=1614 Win=22016 Len=0 TSval=216036791 TSecr=1054097810
964,7.503457,10.19.6.231,104.81.18.27,TCP,66,0.000106,55331  >  443 [ACK] Seq=1614 Ack=3132 Win=128960 Len=0 TSval=1054097866 TSecr=216036793
965,7.503515,10.19.6.231,104.81.18.27,TCP,66,0.000083,55331  >  443 [ACK] Seq=1614 Ack=5224 Win=126848 Len=0 TSval=1054097866 TSecr=216036793
969,7.518385,10.19.6.231,104.81.18.27,TCP,66,0.000476,55331  >  443 [ACK] Seq=1614 Ack=6672 Win=129600 Len=0 TSval=1054097881 TSecr=216036794
970,7.518476,10.19.6.231,104.81.18.27,TCP,66,0.000143,55331  >  443 [ACK] Seq=1614 Ack=7470 Win=128768 Len=0 TSval=1054097881 TSecr=216036794
972,7.558844,104.81.18.27,10.19.6.231,TCP,66,0.00098,443  >  55330 [ACK] Seq=2817 Ack=1549 Win=22144 Len=0 TSval=216036799 TSecr=1054097919
975,7.57889,104.81.18.27,10.19.6.231,TCP,66,0.003091,443  >  55330 [ACK] Seq=2817 Ack=1636 Win=22144 Len=0 TSval=216036800 TSecr=1054097936
977,7.580473,104.81.18.27,10.19.6.231,TCP,66,0.001326,443  >  55330 [ACK] Seq=2817 Ack=1736 Win=22144 Len=0 TSval=216036801 TSecr=1054097939
980,7.590381,104.81.18.27,10.19.6.231,TCP,66,0.000931,443  >  55330 [ACK] Seq=2817 Ack=1864 Win=23296 Len=0 TSval=216036802 TSecr=1054097948
981,7.591164,104.81.18.27,10.19.6.231,TCP,66,0.000945,443  >  55330 [ACK] Seq=2817 Ack=1975 Win=23296 Len=0 TSval=216036802 TSecr=1054097948
983,7.593623,103.254.155.35,10.19.6.231,TCP,74,0.00124,"443  >  55333 [SYN, ACK] Seq=0 Ack=1 Win=18328 Len=0 MSS=9176 SACK_PERM=1 TSval=216036802 TSecr=1054097950 WS=128"
984,7.59371,10.19.6.231,103.254.155.35,TCP,66,0.000087,55333  >  443 [ACK] Seq=1 Ack=1 Win=131712 Len=0 TSval=1054097951 TSecr=216036802
986,7.595384,103.254.155.35,10.19.6.231,TCP,66,0.001392,443  >  55333 [ACK] Seq=1 Ack=556 Win=19456 Len=0 TSval=216036802 TSecr=1054097951
990,7.598641,10.19.6.231,103.254.155.35,TCP,66,0.000119,55332  >  443 [ACK] Seq=530 Ack=2897 Win=129600 Len=0 TSval=1054097954 TSecr=216036802
991,7.598642,10.19.6.231,103.254.155.35,TCP,66,0.000113,55332  >  443 [ACK] Seq=530 Ack=4097 Win=128384 Len=0 TSval=1054097954 TSecr=216036802
993,7.599222,10.19.6.231,103.254.155.35,TCP,66,0.000094,55332  >  443 [ACK] Seq=530 Ack=5453 Win=129664 Len=0 TSval=1054097955 TSecr=216036803
996,7.60568,103.254.155.35,10.19.6.231,TCP,66,0.001345,443  >  55332 [ACK] Seq=5453 Ack=623 Win=19456 Len=0 TSval=216036803 TSecr=1054097959
997,7.605872,103.254.155.35,10.19.6.231,TCP,66,0.001064,443  >  55332 [ACK] Seq=5453 Ack=1221 Win=20608 Len=0 TSval=216036803 TSecr=1054097959
1004,7.691036,10.19.6.231,103.254.155.35,TCP,66,0.000115,55332  >  443 [ACK] Seq=1221 Ack=5743 Win=130752 Len=0 TSval=1054098044 TSecr=216036812
1006,7.692465,10.19.6.231,103.254.155.35,TCP,66,0.000119,55332  >  443 [ACK] Seq=1221 Ack=6289 Win=130496 Len=0 TSval=1054098045 TSecr=216036812
1009,7.725997,10.19.6.231,104.81.18.27,TCP,66,0.000064,55330  >  443 [ACK] Seq=1975 Ack=5606 Win=129728 Len=0 TSval=1054098077 TSecr=216036815
1011,7.743539,10.19.6.231,104.81.18.27,TCP,66,0.000075,55330  >  443 [ACK] Seq=1975 Ack=6652 Win=129984 Len=0 TSval=1054098094 TSecr=216036817
1014,7.752488,10.19.6.231,104.81.18.27,TCP,66,0.000074,55330  >  443 [ACK] Seq=1975 Ack=9393 Win=128320 Len=0 TSval=1054098102 TSecr=216036818
1016,7.762757,104.81.18.27,10.19.6.231,TCP,66,0.001147,443  >  55331 [ACK] Seq=7470 Ack=1969 Win=23168 Len=0 TSval=216036819 TSecr=1054098111
1018,7.763904,10.19.6.231,104.81.18.27,TCP,66,0.000114,55330  >  443 [ACK] Seq=1975 Ack=10841 Win=129600 Len=0 TSval=1054098113 TSecr=216036819
1020,7.76441,10.19.6.231,104.81.18.27,TCP,66,0.000142,55330  >  443 [ACK] Seq=1975 Ack=12289 Win=128128 Len=0 TSval=1054098113 TSecr=216036819
1024,7.776272,10.19.6.231,104.81.18.27,TCP,66,0.000066,55330  >  443 [ACK] Seq=1975 Ack=14683 Win=128640 Len=0 TSval=1054098125 TSecr=216036820
1028,7.859186,10.19.6.231,104.81.18.27,TCP,66,0.000107,55331  >  443 [ACK] Seq=1969 Ack=7908 Win=130624 Len=0 TSval=1054098207 TSecr=216036829
1034,7.937217,10.19.6.231,103.254.155.35,TCP,66,0.00026,55333  >  443 [ACK] Seq=556 Ack=1449 Win=130304 Len=0 TSval=1054098283 TSecr=216036836
1035,7.937217,10.19.6.231,103.254.155.35,TCP,66,0.000249,55333  >  443 [ACK] Seq=556 Ack=2897 Win=128832 Len=0 TSval=1054098283 TSecr=216036836
1036,7.937291,10.19.6.231,103.254.155.35,TCP,66,0.000096,55333  >  443 [ACK] Seq=556 Ack=3206 Win=128512 Len=0 TSval=1054098283 TSecr=216036836
1039,7.9438,103.254.155.35,10.19.6.231,TCP,66,0.001424,443  >  55333 [ACK] Seq=3206 Ack=649 Win=19456 Len=0 TSval=216036837 TSecr=1054098287
1040,7.944129,103.254.155.35,10.19.6.231,TCP,66,0.001293,443  >  55333 [ACK] Seq=3206 Ack=1452 Win=21120 Len=0 TSval=216036837 TSecr=1054098287
1042,7.965736,104.81.18.27,10.19.6.231,TCP,66,0.000991,443  >  55331 [ACK] Seq=7908 Ack=2394 Win=24320 Len=0 TSval=216036839 TSecr=1054098308
1044,8.028529,10.19.6.231,103.254.155.35,TCP,66,0.000077,55333  >  443 [ACK] Seq=1452 Ack=3496 Win=130752 Len=0 TSval=1054098371 TSecr=216036846
1046,8.030704,10.19.6.231,103.254.155.35,TCP,66,0.000079,55333  >  443 [ACK] Seq=1452 Ack=3962 Win=130560 Len=0 TSval=1054098373 TSecr=216036846
1048,8.048464,103.254.155.35,10.19.6.231,TCP,66,0.001353,443  >  55333 [ACK] Seq=3962 Ack=2242 Win=22656 Len=0 TSval=216036848 TSecr=1054098389
1053,8.110207,10.19.6.231,104.81.18.27,TCP,66,0.000076,55331  >  443 [ACK] Seq=2394 Ack=8954 Win=129984 Len=0 TSval=1054098451 TSecr=216036854
1056,8.11069,10.19.6.231,104.81.18.27,TCP,66,0.000065,55331  >  443 [ACK] Seq=2394 Ack=10968 Win=129024 Len=0 TSval=1054098451 TSecr=216036854
1059,8.113938,10.19.6.231,104.81.18.27,TCP,66,0.000591,55331  >  443 [ACK] Seq=2394 Ack=12416 Win=131072 Len=0 TSval=1054098454 TSecr=216036854
1060,8.113996,10.19.6.231,104.81.18.27,TCP,66,0.00008,55331  >  443 [ACK] Seq=2394 Ack=13864 Win=129600 Len=0 TSval=1054098454 TSecr=216036854
1063,8.120284,10.19.6.231,104.81.18.27,TCP,66,0.000061,55331  >  443 [ACK] Seq=2394 Ack=16760 Win=128128 Len=0 TSval=1054098460 TSecr=216036855
1066,8.125754,10.19.6.231,104.81.18.27,TCP,66,0.00008,55331  >  443 [ACK] Seq=2394 Ack=18208 Win=129600 Len=0 TSval=1054098466 TSecr=216036855
1068,8.126006,10.19.6.231,104.81.18.27,TCP,66,0.000139,55331  >  443 [ACK] Seq=2394 Ack=18428 Win=130816 Len=0 TSval=1054098466 TSecr=216036855
1070,8.136067,10.19.6.231,103.254.155.35,TCP,66,0.000162,55333  >  443 [ACK] Seq=2242 Ack=5144 Win=129856 Len=0 TSval=1054098476 TSecr=216036856
1073,8.162723,104.81.18.27,10.19.6.231,TCP,66,0.002058,443  >  55331 [ACK] Seq=18428 Ack=2641 Win=25600 Len=0 TSval=216036859 TSecr=1054098500
1074,8.162932,104.81.18.27,10.19.6.231,TCP,66,0.000958,443  >  55331 [ACK] Seq=18428 Ack=2814 Win=26752 Len=0 TSval=216036859 TSecr=1054098501
1076,8.218247,10.19.6.231,104.81.18.27,TCP,66,0.000069,55331  >  443 [ACK] Seq=2814 Ack=18866 Win=130624 Len=0 TSval=1054098556 TSecr=216036865
1078,8.224836,10.19.6.231,104.81.18.27,TCP,66,0.000067,55331  >  443 [ACK] Seq=2814 Ack=19304 Win=130624 Len=0 TSval=1054098562 TSecr=216036865
1080,8.226789,104.81.18.27,10.19.6.231,TCP,66,0.000956,443  >  55331 [ACK] Seq=19304 Ack=3052 Win=28032 Len=0 TSval=216036865 TSecr=1054098562
1082,8.231625,104.81.18.27,10.19.6.231,TCP,66,0.000985,443  >  55331 [ACK] Seq=19304 Ack=3216 Win=29184 Len=0 TSval=216036866 TSecr=1054098567
1086,8.370707,10.19.6.231,104.81.18.27,TCP,66,0.000085,55331  >  443 [ACK] Seq=3216 Ack=21318 Win=130496 Len=0 TSval=1054098706 TSecr=216036880
1087,8.370707,10.19.6.231,104.81.18.27,TCP,66,0.000081,55331  >  443 [ACK] Seq=3216 Ack=22364 Win=129408 Len=0 TSval=1054098706 TSecr=216036880
1090,8.371744,10.19.6.231,104.81.18.27,TCP,66,0.000057,55331  >  443 [ACK] Seq=3216 Ack=25103 Win=128320 Len=0 TSval=1054098707 TSecr=216036880
1093,8.373335,10.19.6.231,104.81.18.27,TCP,66,0.000412,55331  >  443 [ACK] Seq=3216 Ack=26551 Win=131072 Len=0 TSval=1054098708 TSecr=216036880
1094,8.373419,10.19.6.231,104.81.18.27,TCP,66,0.000101,55331  >  443 [ACK] Seq=3216 Ack=27999 Win=129600 Len=0 TSval=1054098708 TSecr=216036880
1097,8.374885,10.19.6.231,104.81.18.27,TCP,66,0.000062,55331  >  443 [ACK] Seq=3216 Ack=29828 Win=129216 Len=0 TSval=1054098709 TSecr=216036880
1108,9.114867,104.81.18.27,10.19.6.231,TCP,66,0.003626,443  >  55331 [ACK] Seq=29828 Ack=3392 Win=30336 Len=0 TSval=216036954 TSecr=1054099442
1110,9.168406,10.19.6.231,104.81.18.27,TCP,66,0.00021,55331  >  443 [ACK] Seq=3392 Ack=30266 Win=130624 Len=0 TSval=1054099498 TSecr=216036959
1112,9.176141,104.81.18.27,10.19.6.231,TCP,66,0.000955,443  >  55331 [ACK] Seq=30266 Ack=3638 Win=31616 Len=0 TSval=216036960 TSecr=1054099504
1115,9.232194,10.19.6.231,104.81.18.27,TCP,66,0.000076,55331  >  443 [ACK] Seq=3638 Ack=32358 Win=128960 Len=0 TSval=1054099560 TSecr=216036966
1119,9.232427,10.19.6.231,104.81.18.27,TCP,66,0.000076,55331  >  443 [ACK] Seq=3638 Ack=34450 Win=126848 Len=0 TSval=1054099560 TSecr=216036966
1120,9.232478,10.19.6.231,104.81.18.27,TCP,66,0.000125,55331  >  443 [ACK] Seq=3638 Ack=34728 Win=126592 Len=0 TSval=1054099560 TSecr=216036966
1125,9.456443,31.13.79.35,10.19.6.231,TCP,74,0.001208,"443  >  55334 [SYN, ACK] Seq=0 Ack=1 Win=18328 Len=0 MSS=9176 SACK_PERM=1 TSval=216036988 TSecr=1054099782 WS=128"
1126,9.456542,10.19.6.231,31.13.79.35,TCP,66,0.000099,55334  >  443 [ACK] Seq=1 Ack=1 Win=131712 Len=0 TSval=1054099783 TSecr=216036988
1128,9.458235,31.13.79.35,10.19.6.231,TCP,66,0.001395,443  >  55334 [ACK] Seq=1 Ack=518 Win=19456 Len=0 TSval=216036989 TSecr=1054099783
1131,9.833339,10.19.6.231,31.13.79.35,TCP,66,0.000232,55334  >  443 [ACK] Seq=518 Ack=213 Win=131520 Len=0 TSval=1054100158 TSecr=216037016
1136,9.849546,31.13.79.35,10.19.6.231,TCP,66,0.001152,443  >  55334 [ACK] Seq=213 Ack=582 Win=19456 Len=0 TSval=216037028 TSecr=1054100173
1137,9.850147,31.13.79.35,10.19.6.231,TCP,66,0.001473,443  >  55334 [ACK] Seq=213 Ack=668 Win=19456 Len=0 TSval=216037028 TSecr=1054100173
1138,9.850888,31.13.79.35,10.19.6.231,TCP,66,0.001722,443  >  55334 [ACK] Seq=213 Ack=1464 Win=20992 Len=0 TSval=216037028 TSecr=1054100173
1139,9.851414,31.13.79.35,10.19.6.231,TCP,66,0.00214,443  >  55334 [ACK] Seq=213 Ack=2571 Win=23296 Len=0 TSval=216037028 TSecr=1054100173
1142,9.897988,10.19.6.231,31.13.79.35,TCP,66,0.000083,55334  >  443 [ACK] Seq=2571 Ack=370 Win=131392 Len=0 TSval=1054100222 TSecr=216037032
1143,9.897988,10.19.6.231,31.13.79.35,TCP,66,0.00008,55334  >  443 [ACK] Seq=2571 Ack=444 Win=131264 Len=0 TSval=1054100222 TSecr=216037032
1145,9.898128,10.19.6.231,31.13.79.35,TCP,66,0.000039,55334  >  443 [ACK] Seq=2571 Ack=475 Win=131264 Len=0 TSval=1054100222 TSecr=216037032
1147,9.899416,31.13.79.35,10.19.6.231,TCP,66,0.001158,443  >  55334 [ACK] Seq=475 Ack=2602 Win=23296 Len=0 TSval=216037033 TSecr=1054100222
1149,9.899863,10.19.6.231,31.13.79.35,TCP,66,0.000092,55334  >  443 [ACK] Seq=2602 Ack=510 Win=131200 Len=0 TSval=1054100223 TSecr=216037033
1153,10.083594,10.19.6.231,31.13.79.35,TCP,66,0.000078,55334  >  443 [ACK] Seq=2602 Ack=2150 Win=130880 Len=0 TSval=1054100405 TSecr=216037051
1154,10.083673,10.19.6.231,31.13.79.35,TCP,66,0.000154,55334  >  443 [ACK] Seq=2602 Ack=3390 Win=129600 Len=0 TSval=1054100405 TSecr=216037051
1156,10.084116,10.19.6.231,31.13.79.35,TCP,66,0.000237,55334  >  443 [ACK] Seq=2602 Ack=4490 Win=129920 Len=0 TSval=1054100405 TSecr=216037051
1163,11.259127,104.81.18.27,10.19.6.231,TCP,66,0.005398,443  >  55331 [ACK] Seq=34728 Ack=3746 Win=31616 Len=0 TSval=216037168 TSecr=1054101573
1165,11.315031,10.19.6.231,104.81.18.27,TCP,66,0.000074,55331  >  443 [ACK] Seq=3746 Ack=35166 Win=130624 Len=0 TSval=1054101633 TSecr=216037174
1167,11.323382,104.81.18.27,10.19.6.231,TCP,66,0.001949,443  >  55331 [ACK] Seq=35166 Ack=3923 Win=32768 Len=0 TSval=216037175 TSecr=1054101639
1169,11.408049,10.19.6.231,104.81.18.27,TCP,66,0.000075,55331  >  443 [ACK] Seq=3923 Ack=36323 Win=129856 Len=0 TSval=1054101725 TSecr=216037183
1174,11.591644,180.149.52.83,10.19.6.231,TCP,74,0.001294,"443  >  55335 [SYN, ACK] Seq=0 Ack=1 Win=18328 Len=0 MSS=9176 SACK_PERM=1 TSval=216037202 TSecr=1054101906 WS=128"
1175,11.591739,10.19.6.231,180.149.52.83,TCP,66,0.000095,55335  >  443 [ACK] Seq=1 Ack=1 Win=131712 Len=0 TSval=1054101907 TSecr=216037202
1177,11.593875,180.149.52.83,10.19.6.231,TCP,66,0.001654,443  >  55335 [ACK] Seq=1 Ack=518 Win=19456 Len=0 TSval=216037202 TSecr=1054101907
1186,11.903478,10.19.6.231,180.149.52.83,TCP,66,0.000067,55335  >  443 [ACK] Seq=518 Ack=213 Win=131520 Len=0 TSval=1054102215 TSecr=216037226
1187,11.904579,180.149.52.83,10.19.6.231,TCP,74,0.015773,"443  >  55336 [SYN, ACK] Seq=0 Ack=1 Win=18328 Len=0 MSS=9176 SACK_PERM=1 TSval=216037233 TSecr=1054102202 WS=128"
1188,11.904663,10.19.6.231,180.149.52.83,TCP,66,0.000084,55336  >  443 [ACK] Seq=1 Ack=1 Win=131712 Len=0 TSval=1054102216 TSecr=216037233
1189,11.904765,180.149.52.83,10.19.6.231,TCP,74,0.014905,"443  >  55337 [SYN, ACK] Seq=0 Ack=1 Win=18328 Len=0 MSS=9176 SACK_PERM=1 TSval=216037233 TSecr=1054102203 WS=128"
1190,11.904823,10.19.6.231,180.149.52.83,TCP,66,0.000058,55337  >  443 [ACK] Seq=1 Ack=1 Win=131712 Len=0 TSval=1054102216 TSecr=216037233
1191,11.905064,180.149.52.83,10.19.6.231,TCP,74,0.011483,"443  >  55338 [SYN, ACK] Seq=0 Ack=1 Win=18328 Len=0 MSS=9176 SACK_PERM=1 TSval=216037233 TSecr=1054102206 WS=128"
1192,11.905067,180.149.52.83,10.19.6.231,TCP,74,0.01128,"443  >  55339 [SYN, ACK] Seq=0 Ack=1 Win=18328 Len=0 MSS=9176 SACK_PERM=1 TSval=216037233 TSecr=1054102206 WS=128"
1193,11.90512,10.19.6.231,180.149.52.83,TCP,66,0.000056,55338  >  443 [ACK] Seq=1 Ack=1 Win=131712 Len=0 TSval=1054102216 TSecr=216037233
1194,11.905121,10.19.6.231,180.149.52.83,TCP,66,0.000054,55339  >  443 [ACK] Seq=1 Ack=1 Win=131712 Len=0 TSval=1054102216 TSecr=216037233
1196,11.905334,180.149.52.83,10.19.6.231,TCP,74,0.009809,"443  >  55340 [SYN, ACK] Seq=0 Ack=1 Win=18328 Len=0 MSS=9176 SACK_PERM=1 TSval=216037233 TSecr=1054102207 WS=128"
1197,11.905383,10.19.6.231,180.149.52.83,TCP,66,0.000049,55340  >  443 [ACK] Seq=1 Ack=1 Win=131712 Len=0 TSval=1054102216 TSecr=216037233
1202,11.907641,180.149.52.83,10.19.6.231,TCP,66,0.002504,443  >  55336 [ACK] Seq=1 Ack=518 Win=19456 Len=0 TSval=216037233 TSecr=1054102216
1203,11.907909,180.149.52.83,10.19.6.231,TCP,66,0.002353,443  >  55337 [ACK] Seq=1 Ack=518 Win=19456 Len=0 TSval=216037233 TSecr=1054102216
1204,11.907913,180.149.52.83,10.19.6.231,TCP,66,0.002087,443  >  55338 [ACK] Seq=1 Ack=518 Win=19456 Len=0 TSval=216037233 TSecr=1054102217
1205,11.907914,180.149.52.83,10.19.6.231,TCP,66,0.001838,443  >  55339 [ACK] Seq=1 Ack=518 Win=19456 Len=0 TSval=216037233 TSecr=1054102217
1206,11.908108,180.149.52.83,10.19.6.231,TCP,66,0.001584,443  >  55340 [ACK] Seq=1 Ack=518 Win=19456 Len=0 TSval=216037233 TSecr=1054102217
1208,11.917034,180.149.52.83,10.19.6.231,TCP,66,0.001103,443  >  55335 [ACK] Seq=213 Ack=582 Win=19456 Len=0 TSval=216037234 TSecr=1054102226
1215,11.919127,180.149.52.83,10.19.6.231,TCP,66,0.001405,443  >  55335 [ACK] Seq=213 Ack=668 Win=19456 Len=0 TSval=216037235 TSecr=1054102227
1233,11.920451,180.149.52.83,10.19.6.231,TCP,66,0.001178,443  >  55335 [ACK] Seq=213 Ack=1104 Win=20480 Len=0 TSval=216037235 TSecr=1054102229
1236,11.921126,180.149.52.83,10.19.6.231,TCP,66,0.001738,443  >  55335 [ACK] Seq=213 Ack=1297 Win=21632 Len=0 TSval=216037235 TSecr=1054102229
1237,11.922166,180.149.52.83,10.19.6.231,TCP,66,0.002681,443  >  55335 [ACK] Seq=213 Ack=1492 Win=22656 Len=0 TSval=216037235 TSecr=1054102229
1238,11.922169,180.149.52.83,10.19.6.231,TCP,66,0.002617,443  >  55335 [ACK] Seq=213 Ack=1685 Win=23808 Len=0 TSval=216037235 TSecr=1054102229
1239,11.92217,180.149.52.83,10.19.6.231,TCP,66,0.002581,443  >  55335 [ACK] Seq=213 Ack=1878 Win=24832 Len=0 TSval=216037235 TSecr=1054102229
1240,11.922171,180.149.52.83,10.19.6.231,TCP,66,0.002535,443  >  55335 [ACK] Seq=213 Ack=2072 Win=25856 Len=0 TSval=216037235 TSecr=1054102229
1241,11.922174,180.149.52.83,10.19.6.231,TCP,66,0.002391,443  >  55335 [ACK] Seq=213 Ack=2265 Win=27008 Len=0 TSval=216037235 TSecr=1054102229
1242,11.922175,180.149.52.83,10.19.6.231,TCP,66,0.00233,443  >  55335 [ACK] Seq=213 Ack=2458 Win=28032 Len=0 TSval=216037235 TSecr=1054102229
1243,11.922739,180.149.52.83,10.19.6.231,TCP,66,0.002837,443  >  55335 [ACK] Seq=213 Ack=2652 Win=29056 Len=0 TSval=216037235 TSecr=1054102229
1244,11.922742,180.149.52.83,10.19.6.231,TCP,66,0.002785,443  >  55335 [ACK] Seq=213 Ack=2845 Win=30208 Len=0 TSval=216037235 TSecr=1054102229
1245,11.922742,180.149.52.83,10.19.6.231,TCP,66,0.002723,443  >  55335 [ACK] Seq=213 Ack=3037 Win=31232 Len=0 TSval=216037235 TSecr=1054102229
1246,11.922743,180.149.52.83,10.19.6.231,TCP,66,0.002635,443  >  55335 [ACK] Seq=213 Ack=3228 Win=32384 Len=0 TSval=216037235 TSecr=1054102229
1247,11.922744,180.149.52.83,10.19.6.231,TCP,66,0.002571,443  >  55335 [ACK] Seq=213 Ack=3422 Win=33408 Len=0 TSval=216037235 TSecr=1054102230
1248,11.922744,180.149.52.83,10.19.6.231,TCP,66,0.002515,443  >  55335 [ACK] Seq=213 Ack=3614 Win=34432 Len=0 TSval=216037235 TSecr=1054102230
1249,11.922745,180.149.52.83,10.19.6.231,TCP,66,0.002462,443  >  55335 [ACK] Seq=213 Ack=3807 Win=35584 Len=0 TSval=216037235 TSecr=1054102230
1250,11.922746,180.149.52.83,10.19.6.231,TCP,66,0.00241,443  >  55335 [ACK] Seq=213 Ack=4001 Win=36608 Len=0 TSval=216037235 TSecr=1054102230
1251,11.922746,180.149.52.83,10.19.6.231,TCP,66,0.002358,443  >  55335 [ACK] Seq=213 Ack=4194 Win=37632 Len=0 TSval=216037235 TSecr=1054102230
1252,11.922747,180.149.52.83,10.19.6.231,TCP,66,0.002119,443  >  55335 [ACK] Seq=213 Ack=4394 Win=38784 Len=0 TSval=216037235 TSecr=1054102230
1253,11.923164,180.149.52.83,10.19.6.231,TCP,66,0.002301,443  >  55335 [ACK] Seq=213 Ack=4587 Win=39808 Len=0 TSval=216037235 TSecr=1054102230
1254,11.941504,180.149.52.83,10.19.6.231,TCP,66,0.024425,"443  >  55336 [FIN, ACK] Seq=1 Ack=519 Win=19456 Len=0 TSval=216037237 TSecr=1054102227"
1255,11.9416,10.19.6.231,180.149.52.83,TCP,66,0.000096,55336  >  443 [ACK] Seq=519 Ack=2 Win=131712 Len=0 TSval=1054102250 TSecr=216037237
1256,11.941798,180.149.52.83,10.19.6.231,TCP,66,0.024587,"443  >  55337 [FIN, ACK] Seq=1 Ack=519 Win=19456 Len=0 TSval=216037237 TSecr=1054102227"
1257,11.941801,180.149.52.83,10.19.6.231,TCP,66,0.024512,"443  >  55338 [FIN, ACK] Seq=1 Ack=519 Win=19456 Len=0 TSval=216037237 TSecr=1054102227"
1258,11.941802,180.149.52.83,10.19.6.231,TCP,66,0.024217,"443  >  55339 [FIN, ACK] Seq=1 Ack=519 Win=19456 Len=0 TSval=216037237 TSecr=1054102227"
1259,11.94189,10.19.6.231,180.149.52.83,TCP,66,0.000092,55337  >  443 [ACK] Seq=519 Ack=2 Win=131712 Len=0 TSval=1054102250 TSecr=216037237
1260,11.94189,10.19.6.231,180.149.52.83,TCP,66,0.000089,55338  >  443 [ACK] Seq=519 Ack=2 Win=131712 Len=0 TSval=1054102250 TSecr=216037237
1261,11.941891,10.19.6.231,180.149.52.83,TCP,66,0.000089,55339  >  443 [ACK] Seq=519 Ack=2 Win=131712 Len=0 TSval=1054102250 TSecr=216037237
1262,11.942206,180.149.52.83,10.19.6.231,TCP,66,0.024591,"443  >  55340 [FIN, ACK] Seq=1 Ack=519 Win=19456 Len=0 TSval=216037237 TSecr=1054102227"
1263,11.942262,10.19.6.231,180.149.52.83,TCP,66,0.000056,55340  >  443 [ACK] Seq=519 Ack=2 Win=131712 Len=0 TSval=1054102250 TSecr=216037237
1265,11.95219,10.19.6.231,180.149.52.83,TCP,66,0.000069,55335  >  443 [ACK] Seq=4587 Ack=370 Win=131392 Len=0 TSval=1054102260 TSecr=216037238
1267,11.952595,10.19.6.231,180.149.52.83,TCP,66,0.000068,55335  >  443 [ACK] Seq=4587 Ack=444 Win=131264 Len=0 TSval=1054102260 TSecr=216037238
1270,11.954239,10.19.6.231,180.149.52.83,TCP,66,0.000062,55335  >  443 [ACK] Seq=4618 Ack=475 Win=131264 Len=0 TSval=1054102262 TSecr=216037238
1271,11.955825,180.149.52.83,10.19.6.231,TLSv1.3,101,0.002828,Application Data
1273,11.955936,10.19.6.231,180.149.52.83,TCP,66,0.000111,55335  >  443 [ACK] Seq=4618 Ack=510 Win=131200 Len=0 TSval=1054102263 TSecr=216037238
1274,11.955937,10.19.6.231,180.149.52.83,TCP,66,0.000108,55335  >  443 [ACK] Seq=4618 Ack=545 Win=131200 Len=0 TSval=1054102263 TSecr=216037238
1278,11.956442,10.19.6.231,180.149.52.83,TCP,66,0.000065,55335  >  443 [ACK] Seq=4618 Ack=863 Win=130880 Len=0 TSval=1054102263 TSecr=216037238
1279,11.956454,10.19.6.231,180.149.52.83,TCP,66,0.000074,55335  >  443 [ACK] Seq=4618 Ack=2035 Win=129728 Len=0 TSval=1054102263 TSecr=216037238
1280,11.956455,10.19.6.231,180.149.52.83,TCP,66,0.000073,55335  >  443 [ACK] Seq=4618 Ack=2139 Win=129600 Len=0 TSval=1054102263 TSecr=216037238
1283,11.957112,10.19.6.231,180.149.52.83,TCP,66,0.000077,55335  >  443 [ACK] Seq=4618 Ack=3402 Win=129792 Len=0 TSval=1054102264 TSecr=216037238
1284,11.957113,10.19.6.231,180.149.52.83,TCP,66,0.000073,55335  >  443 [ACK] Seq=4618 Ack=3437 Win=129728 Len=0 TSval=1054102264 TSecr=216037238
1289,11.987805,10.19.6.231,180.149.52.83,TCP,66,0.000063,55335  >  443 [ACK] Seq=4618 Ack=5161 Win=130752 Len=0 TSval=1054102294 TSecr=216037241
1291,11.989012,10.19.6.231,180.149.52.83,TCP,66,0.000069,55335  >  443 [ACK] Seq=4618 Ack=5184 Win=131008 Len=0 TSval=1054102295 TSecr=216037242
1294,11.989438,10.19.6.231,180.149.52.83,TCP,66,0.00005,55335  >  443 [ACK] Seq=4618 Ack=7611 Win=128640 Len=0 TSval=1054102295 TSecr=216037242
