"No.","Time","Source","Destination","Protocol","Length","RTT","Info"
"2","0.003862","172.217.166.14","10.150.33.220","TCP","66","0.003862000","443  >  55633 [ACK] Seq=1 Ack=341 Win=181 Len=0 TSval=176844696 TSecr=613551009"
"8","0.060485","10.150.33.220","172.217.166.14","TCP","66","0.000137000","55633  >  443 [ACK] Seq=341 Ack=101 Win=2046 Len=0 TSval=613551068 TSecr=176844701"
"9","0.060556","10.150.33.220","172.217.166.14","TCP","66","0.000202000","55633  >  443 [ACK] Seq=341 Ack=167 Win=2045 Len=0 TSval=613551068 TSecr=176844701"
"10","0.060556","10.150.33.220","172.217.166.14","TCP","66","0.000119000","55633  >  443 [ACK] Seq=341 Ack=206 Win=2044 Len=0 TSval=613551068 TSecr=176844701"
"12","0.062117","172.217.166.14","10.150.33.220","TCP","66","0.000852000","443  >  55633 [ACK] Seq=206 Ack=380 Win=181 Len=0 TSval=176844701 TSecr=613551068"
"45","2.868573","172.217.24.228","10.150.33.220","TCP","74","0.001493000","443  >  55634 [SYN, ACK] Seq=0 Ack=1 Win=18328 Len=0 MSS=1396 SACK_PERM=1 TSval=176844982 TSecr=613553868 WS=128"
"46","2.868670","10.150.33.220","172.217.24.228","TCP","66","0.000097000","55634  >  443 [ACK] Seq=1 Ack=1 Win=131456 Len=0 TSval=613553869 TSecr=176844982"
"48","2.870282","172.217.24.228","10.150.33.220","TCP","66","0.001180000","443  >  55634 [ACK] Seq=1 Ack=585 Win=19584 Len=0 TSval=176844982 TSecr=613553869"
"53","2.962058","172.217.24.228","10.150.33.220","TCP","74","0.001440000","443  >  55635 [SYN, ACK] Seq=0 Ack=1 Win=18328 Len=0 MSS=1396 SACK_PERM=1 TSval=176844991 TSecr=613553959 WS=128"
"54","2.962144","10.150.33.220","172.217.24.228","TCP","66","0.000086000","55635  >  443 [ACK] Seq=1 Ack=1 Win=131456 Len=0 TSval=613553960 TSecr=176844991"
"56","2.964560","172.217.24.228","10.150.33.220","TCP","66","0.002137000","443  >  55635 [ACK] Seq=1 Ack=585 Win=19584 Len=0 TSval=176844992 TSecr=613553960"
"62","3.131113","10.150.33.220","172.217.24.228","TCP","66","0.000129000","55634  >  443 [ACK] Seq=585 Ack=213 Win=131264 Len=0 TSval=613554127 TSecr=176845008"
"66","3.145462","172.217.24.228","10.150.33.220","TCP","66","0.005046000","443  >  55634 [ACK] Seq=213 Ack=649 Win=19584 Len=0 TSval=176845010 TSecr=613554136"
"67","3.145638","172.217.24.228","10.150.33.220","TCP","66","0.004868000","443  >  55634 [ACK] Seq=213 Ack=735 Win=19584 Len=0 TSval=176845010 TSecr=613554136"
"68","3.146037","172.217.24.228","10.150.33.220","TCP","66","0.004364000","443  >  55634 [ACK] Seq=213 Ack=2118 Win=22272 Len=0 TSval=176845010 TSecr=613554137"
"70","3.200564","10.150.33.220","172.217.24.228","TCP","66","0.000104000","55634  >  443 [ACK] Seq=2118 Ack=793 Win=130688 Len=0 TSval=613554194 TSecr=176845015"
"73","3.201094","10.150.33.220","172.217.24.228","TCP","66","0.000069000","55634  >  443 [ACK] Seq=2149 Ack=824 Win=131008 Len=0 TSval=613554194 TSecr=176845015"
"74","3.210495","172.217.24.228","10.150.33.220","TCP","66","0.009602000","443  >  55634 [ACK] Seq=824 Ack=2149 Win=22272 Len=0 TSval=176845016 TSecr=613554194"
"76","3.231649","10.150.33.220","172.217.24.228","TCP","66","0.000104000","55635  >  443 [ACK] Seq=585 Ack=213 Win=131264 Len=0 TSval=613554225 TSecr=176845018"
"78","3.234513","172.217.24.228","10.150.33.220","TCP","66","0.000996000","443  >  55635 [ACK] Seq=213 Ack=649 Win=19584 Len=0 TSval=176845019 TSecr=613554226"
"80","3.237284","172.217.24.228","10.150.33.220","TCP","66","0.000929000","443  >  55634 [ACK] Seq=824 Ack=2184 Win=22272 Len=0 TSval=176845019 TSecr=613554228"
"82","3.239209","172.217.24.228","10.150.33.220","TCP","66","0.001013000","443  >  55634 [ACK] Seq=824 Ack=2379 Win=25088 Len=0 TSval=176845019 TSecr=613554229"
"85","3.402582","10.150.33.220","172.217.24.228","TCP","66","0.000112000","55634  >  443 [ACK] Seq=2379 Ack=1313 Win=130560 Len=0 TSval=613554392 TSecr=176845035"
"87","3.404227","10.150.33.220","172.217.24.228","TCP","66","0.000095000","55634  >  443 [ACK] Seq=2379 Ack=1775 Win=130560 Len=0 TSval=613554393 TSecr=176845035"
"90","3.406478","10.150.33.220","172.217.24.228","TCP","66","0.000122000","55634  >  443 [ACK] Seq=2379 Ack=1807 Win=131008 Len=0 TSval=613554395 TSecr=176845036"
"91","3.406544","10.150.33.220","172.217.24.228","TCP","66","0.000181000","55634  >  443 [ACK] Seq=2379 Ack=1838 Win=131008 Len=0 TSval=613554395 TSecr=176845036"
"93","3.406717","10.150.33.220","172.217.24.228","TCP","66","0.000053000","55634  >  443 [ACK] Seq=2379 Ack=1877 Win=131008 Len=0 TSval=613554395 TSecr=176845036"
"95","3.409340","172.217.24.228","10.150.33.220","TCP","66","0.000915000","443  >  55634 [ACK] Seq=1877 Ack=2418 Win=25088 Len=0 TSval=176845036 TSecr=613554396"
"98","3.678247","172.217.24.228","10.150.33.220","TCP","66","0.006985000","443  >  55634 [ACK] Seq=1877 Ack=2620 Win=27904 Len=0 TSval=176845063 TSecr=613554657"
"100","3.862609","10.150.33.220","172.217.24.228","TCP","66","0.000103000","55634  >  443 [ACK] Seq=2620 Ack=2083 Win=130816 Len=0 TSval=613554846 TSecr=176845081"
"102","3.862961","10.150.33.220","172.217.24.228","TCP","66","0.000169000","55634  >  443 [ACK] Seq=2620 Ack=2478 Win=130624 Len=0 TSval=613554846 TSecr=176845081"
"105","3.866443","10.150.33.220","172.217.24.228","TCP","66","0.000169000","55634  >  443 [ACK] Seq=2620 Ack=2510 Win=131008 Len=0 TSval=613554849 TSecr=176845082"
"106","3.866510","10.150.33.220","172.217.24.228","TCP","66","0.000103000","55634  >  443 [ACK] Seq=2620 Ack=2541 Win=131008 Len=0 TSval=613554849 TSecr=176845082"
"108","3.866785","10.150.33.220","172.217.24.228","TCP","66","0.000079000","55634  >  443 [ACK] Seq=2620 Ack=2580 Win=131008 Len=0 TSval=613554849 TSecr=176845082"
"110","3.869008","172.217.24.228","10.150.33.220","TCP","66","0.000968000","443  >  55634 [ACK] Seq=2580 Ack=2659 Win=27904 Len=0 TSval=176845082 TSecr=613554850"
"115","3.995219","104.81.18.27","10.150.33.220","TCP","74","0.002037000","443  >  55636 [SYN, ACK] Seq=0 Ack=1 Win=18328 Len=0 MSS=1396 SACK_PERM=1 TSval=176845095 TSecr=613554974 WS=128"
"116","3.995345","10.150.33.220","104.81.18.27","TCP","66","0.000126000","55636  >  443 [ACK] Seq=1 Ack=1 Win=131456 Len=0 TSval=613554976 TSecr=176845095"
"118","3.997657","104.81.18.27","10.150.33.220","TCP","66","0.001642000","443  >  55636 [ACK] Seq=1 Ack=518 Win=19456 Len=0 TSval=176845095 TSecr=613554976"
"127","4.371016","10.150.33.220","104.81.18.27","TCP","66","0.000134000","55636  >  443 [ACK] Seq=518 Ack=2769 Win=128704 Len=0 TSval=613555349 TSecr=176845127"
"128","4.371017","10.150.33.220","104.81.18.27","TCP","66","0.000134000","55636  >  443 [ACK] Seq=518 Ack=3811 Win=127616 Len=0 TSval=613555349 TSecr=176845127"
"132","4.415673","104.81.18.27","10.150.33.220","TCP","66","0.000984000","443  >  55636 [ACK] Seq=3811 Ack=598 Win=19456 Len=0 TSval=176845137 TSecr=613555392"
"135","4.420342","104.81.18.27","10.150.33.220","TCP","66","0.005338000","443  >  55636 [ACK] Seq=3811 Ack=684 Win=19456 Len=0 TSval=176845137 TSecr=613555392"
"136","4.420892","104.81.18.27","10.150.33.220","TCP","66","0.005193000","443  >  55636 [ACK] Seq=3811 Ack=2068 Win=22272 Len=0 TSval=176845137 TSecr=613555392"
"137","4.421268","104.81.18.27","10.150.33.220","TCP","66","0.005568000","443  >  55636 [ACK] Seq=3811 Ack=3410 Win=24960 Len=0 TSval=176845137 TSecr=613555392"
"139","4.459326","10.150.33.220","104.81.18.27","TCP","66","0.000133000","55636  >  443 [ACK] Seq=3410 Ack=4353 Win=130496 Len=0 TSval=613555434 TSecr=176845141"
"141","4.462442","10.150.33.220","104.81.18.27","TCP","66","0.000115000","55636  >  443 [ACK] Seq=3410 Ack=4423 Win=130944 Len=0 TSval=613555437 TSecr=176845141"
"143","4.463433","104.81.18.27","10.150.33.220","TCP","66","0.000771000","443  >  55636 [ACK] Seq=4423 Ack=3441 Win=24960 Len=0 TSval=176845142 TSecr=613555437"
"145","4.470122","10.150.33.220","104.81.18.27","TCP","66","0.000158000","55636  >  443 [ACK] Seq=3441 Ack=5469 Win=129984 Len=0 TSval=613555444 TSecr=176845142"
"148","4.477590","10.150.33.220","104.81.18.27","TCP","66","0.000130000","55636  >  443 [ACK] Seq=3441 Ack=7561 Win=130304 Len=0 TSval=613555450 TSecr=176845142"
"151","4.483545","10.150.33.220","104.81.18.27","TCP","66","0.000089000","55636  >  443 [ACK] Seq=3441 Ack=9653 Win=128960 Len=0 TSval=613555456 TSecr=176845143"
"154","4.495838","10.150.33.220","104.81.18.27","TCP","66","0.000091000","55636  >  443 [ACK] Seq=3441 Ack=12421 Win=128256 Len=0 TSval=613555468 TSecr=176845144"
"157","4.496512","10.150.33.220","104.81.18.27","TCP","66","0.000051000","55636  >  443 [ACK] Seq=3441 Ack=12549 Win=130944 Len=0 TSval=613555468 TSecr=176845144"
"160","4.507077","10.150.33.220","104.81.18.27","TCP","66","0.000114000","55636  >  443 [ACK] Seq=3441 Ack=15317 Win=128256 Len=0 TSval=613555479 TSecr=176845146"
"162","4.507788","10.150.33.220","104.81.18.27","TCP","66","0.000074000","55636  >  443 [ACK] Seq=3441 Ack=15445 Win=128128 Len=0 TSval=613555479 TSecr=176845146"
"167","4.520318","10.150.33.220","104.81.18.27","TCP","66","0.000205000","55636  >  443 [ACK] Seq=3441 Ack=18213 Win=128256 Len=0 TSval=613555492 TSecr=176845147"
"168","4.520389","10.150.33.220","104.81.18.27","TCP","66","0.000097000","55636  >  443 [ACK] Seq=3441 Ack=18341 Win=128128 Len=0 TSval=613555492 TSecr=176845147"
"173","4.535587","10.150.33.220","104.81.18.27","TCP","66","0.000057000","55636  >  443 [ACK] Seq=3441 Ack=21109 Win=128256 Len=0 TSval=613555507 TSecr=176845149"
"174","4.535588","10.150.33.220","104.81.18.27","TCP","66","0.000055000","55636  >  443 [ACK] Seq=3441 Ack=21237 Win=128128 Len=0 TSval=613555507 TSecr=176845149"
"178","4.544529","10.150.33.220","104.81.18.27","TCP","66","0.000095000","55636  >  443 [ACK] Seq=3441 Ack=22685 Win=129600 Len=0 TSval=613555516 TSecr=176845150"
"181","4.546530","10.150.33.220","104.81.18.27","TCP","66","0.000045000","55636  >  443 [ACK] Seq=3441 Ack=24133 Win=129600 Len=0 TSval=613555517 TSecr=176845150"
"187","4.574623","10.150.33.220","104.81.18.27","TCP","66","0.000057000","55636  >  443 [ACK] Seq=3441 Ack=26901 Win=128256 Len=0 TSval=613555544 TSecr=176845150"
"188","4.574623","10.150.33.220","104.81.18.27","TCP","66","0.000055000","55636  >  443 [ACK] Seq=3441 Ack=27029 Win=128128 Len=0 TSval=613555544 TSecr=176845150"
"192","4.578422","10.150.33.220","104.81.18.27","TCP","66","0.000097000","55636  >  443 [ACK] Seq=3441 Ack=29797 Win=128256 Len=0 TSval=613555548 TSecr=176845151"
"199","4.580693","10.150.33.220","104.81.18.27","TCP","66","0.000088000","55636  >  443 [ACK] Seq=3441 Ack=31373 Win=129472 Len=0 TSval=613555550 TSecr=176845151"
"200","4.580693","10.150.33.220","104.81.18.27","TCP","66","0.000085000","55636  >  443 [ACK] Seq=3441 Ack=34141 Win=126720 Len=0 TSval=613555550 TSecr=176845152"
"201","4.580756","10.150.33.220","104.81.18.27","TCP","66","0.000146000","55636  >  443 [ACK] Seq=3441 Ack=34269 Win=126592 Len=0 TSval=613555550 TSecr=176845152"
"206","4.581384","10.150.33.220","104.81.18.27","TCP","66","0.000074000","55636  >  443 [ACK] Seq=3441 Ack=37037 Win=128256 Len=0 TSval=613555550 TSecr=176845153"
"207","4.581385","10.150.33.220","104.81.18.27","TCP","66","0.000074000","55636  >  443 [ACK] Seq=3441 Ack=37165 Win=128128 Len=0 TSval=613555550 TSecr=176845153"
"210","4.582861","10.150.33.220","104.81.18.27","TCP","66","0.000080000","55636  >  443 [ACK] Seq=3441 Ack=37477 Win=130752 Len=0 TSval=613555552 TSecr=176845153"
"219","4.818481","172.217.24.238","10.150.33.220","TCP","66","0.003654000","443  >  55609 [ACK] Seq=1 Ack=453 Win=188 Len=0 TSval=176845177 TSecr=613555783"
"220","4.818985","172.217.24.238","10.150.33.220","TCP","66","0.003438000","443  >  55609 [ACK] Seq=1 Ack=492 Win=188 Len=0 TSval=176845177 TSecr=613555783"
"221","4.819481","172.217.24.238","10.150.33.220","TCP","66","0.003933000","443  >  55609 [ACK] Seq=1 Ack=1876 Win=209 Len=0 TSval=176845177 TSecr=613555783"
"222","4.819727","172.217.24.238","10.150.33.220","TCP","66","0.004179000","443  >  55609 [ACK] Seq=1 Ack=2258 Win=231 Len=0 TSval=176845177 TSecr=613555783"
"226","4.846911","13.33.142.118","10.150.33.220","TCP","74","0.001391000","443  >  55637 [SYN, ACK] Seq=0 Ack=1 Win=18328 Len=0 MSS=1396 SACK_PERM=1 TSval=176845180 TSecr=613555812 WS=128"
"227","4.847005","10.150.33.220","13.33.142.118","TCP","66","0.000094000","55637  >  443 [ACK] Seq=1 Ack=1 Win=131456 Len=0 TSval=613555813 TSecr=176845180"
"229","4.849257","13.33.142.118","10.150.33.220","TCP","66","0.001740000","443  >  55637 [ACK] Seq=1 Ack=518 Win=19456 Len=0 TSval=176845180 TSecr=613555813"
"231","4.874204","10.150.33.220","172.217.24.238","TCP","66","0.000086000","55609  >  443 [ACK] Seq=2258 Ack=40 Win=2047 Len=0 TSval=613555838 TSecr=176845183"
"234","4.933906","10.150.33.220","13.33.142.118","TCP","66","0.000078000","55637  >  443 [ACK] Seq=518 Ack=1449 Win=131008 Len=0 TSval=613555897 TSecr=176845188"
"241","4.939233","10.150.33.220","13.33.142.118","TCP","66","0.000072000","55637  >  443 [ACK] Seq=518 Ack=2897 Win=131008 Len=0 TSval=613555902 TSecr=176845188"
"245","4.939400","10.150.33.220","13.33.142.118","TCP","66","0.000049000","55637  >  443 [ACK] Seq=518 Ack=4345 Win=129600 Len=0 TSval=613555902 TSecr=176845188"
"246","4.939401","10.150.33.220","13.33.142.118","TCP","66","0.000049000","55637  >  443 [ACK] Seq=518 Ack=4957 Win=128960 Len=0 TSval=613555902 TSecr=176845188"
"247","4.940099","104.81.18.27","10.150.33.220","TCP","66","0.002956000","443  >  55636 [ACK] Seq=37477 Ack=3865 Win=27776 Len=0 TSval=176845189 TSecr=613555900"
"248","4.941283","104.81.18.27","10.150.33.220","TCP","66","0.003319000","443  >  55636 [ACK] Seq=37477 Ack=4076 Win=27776 Len=0 TSval=176845189 TSecr=613555900"
"250","4.954715","13.33.142.118","10.150.33.220","TCP","66","0.001355000","443  >  55637 [ACK] Seq=4957 Ack=644 Win=19456 Len=0 TSval=176845191 TSecr=613555916"
"259","4.985645","10.150.33.220","104.81.18.27","TCP","66","0.000089000","55636  >  443 [ACK] Seq=4076 Ack=40245 Win=128256 Len=0 TSval=613555947 TSecr=176845194"
"263","4.986017","10.150.33.220","104.81.18.27","TCP","66","0.000068000","55636  >  443 [ACK] Seq=4076 Ack=41661 Win=129600 Len=0 TSval=613555947 TSecr=176845194"
"267","4.987719","10.150.33.220","104.81.18.27","TCP","66","0.000061000","55636  >  443 [ACK] Seq=4076 Ack=44429 Win=128256 Len=0 TSval=613555949 TSecr=176845194"
"268","4.987719","10.150.33.220","104.81.18.27","TCP","66","0.000059000","55636  >  443 [ACK] Seq=4076 Ack=44557 Win=128128 Len=0 TSval=613555949 TSecr=176845194"
"273","4.994163","10.150.33.220","104.81.18.27","TCP","66","0.000101000","55636  >  443 [ACK] Seq=4076 Ack=47325 Win=128256 Len=0 TSval=613555955 TSecr=176845194"
"274","4.994164","10.150.33.220","104.81.18.27","TCP","66","0.000044000","55636  >  443 [ACK] Seq=4076 Ack=47453 Win=128128 Len=0 TSval=613555955 TSecr=176845194"
"279","4.995863","10.150.33.220","104.81.18.27","TCP","66","0.000067000","55636  >  443 [ACK] Seq=4076 Ack=50221 Win=128256 Len=0 TSval=613555956 TSecr=176845195"
"280","4.995918","10.150.33.220","104.81.18.27","TCP","66","0.000119000","55636  >  443 [ACK] Seq=4076 Ack=50349 Win=128128 Len=0 TSval=613555956 TSecr=176845195"
"283","4.996662","10.150.33.220","13.33.142.118","TCP","66","0.000247000","55637  >  443 [ACK] Seq=644 Ack=5127 Win=130880 Len=0 TSval=613555956 TSecr=176845195"
"285","4.998799","13.33.142.118","10.150.33.220","TCP","66","0.001768000","443  >  55637 [ACK] Seq=5127 Ack=1165 Win=20480 Len=0 TSval=176845195 TSecr=613555957"
"288","5.001214","10.150.33.220","104.81.18.27","TCP","66","0.000085000","55636  >  443 [ACK] Seq=4076 Ack=53117 Win=129664 Len=0 TSval=613555959 TSecr=176845195"
"290","5.001680","10.150.33.220","104.81.18.27","TCP","66","0.000054000","55636  >  443 [ACK] Seq=4076 Ack=53245 Win=130944 Len=0 TSval=613555960 TSecr=176845195"
"294","5.003872","10.150.33.220","104.81.18.27","TCP","66","0.000119000","55636  >  443 [ACK] Seq=4076 Ack=56013 Win=128256 Len=0 TSval=613555962 TSecr=176845195"
"295","5.003935","10.150.33.220","104.81.18.27","TCP","66","0.000081000","55636  >  443 [ACK] Seq=4076 Ack=56141 Win=128128 Len=0 TSval=613555962 TSecr=176845195"
"303","5.010833","10.150.33.220","104.81.18.27","TCP","66","0.000076000","55636  >  443 [ACK] Seq=4076 Ack=58909 Win=129664 Len=0 TSval=613555968 TSecr=176845196"
"304","5.010833","10.150.33.220","104.81.18.27","TCP","66","0.000071000","55636  >  443 [ACK] Seq=4076 Ack=59037 Win=129536 Len=0 TSval=613555968 TSecr=176845196"
"309","5.012064","10.150.33.220","104.81.18.27","TCP","66","0.000216000","55636  >  443 [ACK] Seq=4076 Ack=60421 Win=131072 Len=0 TSval=613555969 TSecr=176845196"
"310","5.012104","10.150.33.220","104.81.18.27","TCP","66","0.000061000","55636  >  443 [ACK] Seq=4076 Ack=61933 Win=129536 Len=0 TSval=613555969 TSecr=176845196"
"314","5.016104","10.150.33.220","104.81.18.27","TCP","66","0.000115000","55636  >  443 [ACK] Seq=4076 Ack=64701 Win=128256 Len=0 TSval=613555973 TSecr=176845197"
"315","5.016175","10.150.33.220","104.81.18.27","TCP","66","0.000120000","55636  >  443 [ACK] Seq=4076 Ack=64829 Win=128128 Len=0 TSval=613555973 TSecr=176845197"
"319","5.019925","10.150.33.220","104.81.18.27","TCP","66","0.000085000","55636  >  443 [ACK] Seq=4076 Ack=66277 Win=129600 Len=0 TSval=613555976 TSecr=176845197"
"321","5.020827","10.150.33.220","104.81.18.27","TCP","66","0.000185000","55636  >  443 [ACK] Seq=4076 Ack=67661 Win=131072 Len=0 TSval=613555976 TSecr=176845197"
"323","5.021267","10.150.33.220","104.81.18.27","TCP","66","0.000084000","55636  >  443 [ACK] Seq=4076 Ack=67725 Win=131008 Len=0 TSval=613555977 TSecr=176845197"
"327","5.024238","10.150.33.220","104.81.18.27","TCP","66","0.000083000","55636  >  443 [ACK] Seq=4076 Ack=70493 Win=128256 Len=0 TSval=613555979 TSecr=176845198"
"328","5.024239","10.150.33.220","104.81.18.27","TCP","66","0.000082000","55636  >  443 [ACK] Seq=4076 Ack=70621 Win=128128 Len=0 TSval=613555979 TSecr=176845198"
"333","5.028935","10.150.33.220","104.81.18.27","TCP","66","0.000133000","55636  >  443 [ACK] Seq=4076 Ack=73389 Win=128256 Len=0 TSval=613555983 TSecr=176845198"
"335","5.029048","10.150.33.220","104.81.18.27","TCP","66","0.000135000","55636  >  443 [ACK] Seq=4076 Ack=73517 Win=130944 Len=0 TSval=613555983 TSecr=176845198"
"338","5.031556","10.150.33.220","104.81.18.27","TCP","66","0.000090000","55636  >  443 [ACK] Seq=4076 Ack=76285 Win=129664 Len=0 TSval=613555985 TSecr=176845198"
"341","5.032826","10.150.33.220","104.81.18.27","TCP","66","0.000095000","55636  >  443 [ACK] Seq=4076 Ack=77861 Win=129472 Len=0 TSval=613555986 TSecr=176845198"
"343","5.036584","10.150.33.220","104.81.18.27","TCP","66","0.000135000","55636  >  443 [ACK] Seq=4076 Ack=79245 Win=131072 Len=0 TSval=613555989 TSecr=176845198"
"346","5.040583","10.150.33.220","104.81.18.27","TCP","66","0.000083000","55636  >  443 [ACK] Seq=4076 Ack=80757 Win=129536 Len=0 TSval=613555993 TSecr=176845198"
"350","5.040956","10.150.33.220","104.81.18.27","TCP","66","0.000253000","55636  >  443 [ACK] Seq=4076 Ack=82141 Win=131072 Len=0 TSval=613555993 TSecr=176845198"
"351","5.040988","10.150.33.220","104.81.18.27","TCP","66","0.000050000","55636  >  443 [ACK] Seq=4076 Ack=83653 Win=129536 Len=0 TSval=613555993 TSecr=176845198"
"353","5.041943","10.150.33.220","172.217.24.238","TCP","66","0.000083000","55609  >  443 [ACK] Seq=2258 Ack=336 Win=2043 Len=0 TSval=613555994 TSecr=176845198"
"356","5.042143","10.150.33.220","104.81.18.27","TCP","66","0.000073000","55636  >  443 [ACK] Seq=4076 Ack=86421 Win=128256 Len=0 TSval=613555994 TSecr=176845198"
"358","5.042268","10.150.33.220","104.81.18.27","TCP","66","0.000055000","55636  >  443 [ACK] Seq=4076 Ack=86549 Win=128128 Len=0 TSval=613555994 TSecr=176845198"
"363","5.044679","10.150.33.220","104.81.18.27","TCP","66","0.000074000","55636  >  443 [ACK] Seq=4076 Ack=89317 Win=128256 Len=0 TSval=613555996 TSecr=176845199"
"364","5.044680","10.150.33.220","104.81.18.27","TCP","66","0.000072000","55636  >  443 [ACK] Seq=4076 Ack=89445 Win=128128 Len=0 TSval=613555996 TSecr=176845199"
"374","5.045398","10.150.33.220","104.81.18.27","TCP","66","0.000461000","55636  >  443 [ACK] Seq=4076 Ack=92213 Win=128256 Len=0 TSval=613555996 TSecr=176845199"
"375","5.045398","10.150.33.220","104.81.18.27","TCP","66","0.000457000","55636  >  443 [ACK] Seq=4076 Ack=92341 Win=128128 Len=0 TSval=613555996 TSecr=176845199"
"376","5.045398","10.150.33.220","172.217.24.238","TCP","66","0.000218000","55609  >  443 [ACK] Seq=2258 Ack=1103 Win=2036 Len=0 TSval=613555996 TSecr=176845199"
"377","5.045440","10.150.33.220","172.217.24.238","TCP","66","0.000256000","55609  >  443 [ACK] Seq=2258 Ack=1161 Win=2035 Len=0 TSval=613555996 TSecr=176845199"
"378","5.045450","10.150.33.220","172.217.24.238","TCP","66","0.000264000","55609  >  443 [ACK] Seq=2258 Ack=1274 Win=2033 Len=0 TSval=613555996 TSecr=176845199"
"379","5.045457","10.150.33.220","172.217.24.238","TCP","66","0.000270000","55609  >  443 [ACK] Seq=2258 Ack=1313 Win=2032 Len=0 TSval=613555996 TSecr=176845199"
"380","5.045591","10.150.33.220","13.33.142.118","TCP","66","0.000230000","55637  >  443 [ACK] Seq=1165 Ack=5540 Win=130624 Len=0 TSval=613555996 TSecr=176845199"
"385","5.049643","10.150.33.220","104.81.18.27","TCP","66","0.000080000","55636  >  443 [ACK] Seq=4076 Ack=95109 Win=129664 Len=0 TSval=613556000 TSecr=176845200"
"388","5.049810","10.150.33.220","104.81.18.27","TCP","66","0.000053000","55636  >  443 [ACK] Seq=4076 Ack=97877 Win=128256 Len=0 TSval=613556000 TSecr=176845200"
"393","5.056361","10.150.33.220","104.81.18.27","TCP","66","0.000144000","55636  >  443 [ACK] Seq=4076 Ack=100645 Win=129664 Len=0 TSval=613556006 TSecr=176845200"
"395","5.056668","10.150.33.220","104.81.18.27","TCP","66","0.000446000","55636  >  443 [ACK] Seq=4076 Ack=102029 Win=131072 Len=0 TSval=613556006 TSecr=176845200"
"397","5.056825","10.150.33.220","104.81.18.27","TCP","66","0.000056000","55636  >  443 [ACK] Seq=4076 Ack=104797 Win=129664 Len=0 TSval=613556006 TSecr=176845200"
"399","5.057065","10.150.33.220","104.81.18.27","TCP","66","0.000088000","55636  >  443 [ACK] Seq=4076 Ack=106181 Win=131072 Len=0 TSval=613556006 TSecr=176845200"
"403","5.057512","10.150.33.220","104.81.18.27","TCP","66","0.000064000","55636  >  443 [ACK] Seq=4076 Ack=108949 Win=129664 Len=0 TSval=613556007 TSecr=176845200"
"404","5.057548","10.150.33.220","104.81.18.27","TCP","66","0.000096000","55636  >  443 [ACK] Seq=4076 Ack=110333 Win=131072 Len=0 TSval=613556007 TSecr=176845200"
"414","5.057927","10.150.33.220","104.81.18.27","TCP","66","0.000064000","55636  >  443 [ACK] Seq=4076 Ack=113101 Win=129664 Len=0 TSval=613556007 TSecr=176845200"
"415","5.057927","10.150.33.220","104.81.18.27","TCP","66","0.000060000","55636  >  443 [ACK] Seq=4076 Ack=115869 Win=126912 Len=0 TSval=613556007 TSecr=176845200"
"416","5.057942","10.150.33.220","104.81.18.27","TCP","66","0.000073000","55636  >  443 [ACK] Seq=4076 Ack=118637 Win=124096 Len=0 TSval=613556007 TSecr=176845200"
"417","5.057947","10.150.33.220","104.81.18.27","TCP","66","0.000074000","55636  >  443 [ACK] Seq=4076 Ack=121405 Win=121344 Len=0 TSval=613556007 TSecr=176845200"
"418","5.057952","10.150.33.220","104.81.18.27","TCP","66","0.000078000","55636  >  443 [ACK] Seq=4076 Ack=122749 Win=120000 Len=0 TSval=613556007 TSecr=176845200"
"420","5.058594","172.217.24.238","10.150.33.220","TCP","66","0.010153000","443  >  55609 [ACK] Seq=1313 Ack=2297 Win=231 Len=0 TSval=176845201 TSecr=613555999"
"424","5.061665","10.150.33.220","104.81.18.27","TCP","66","0.000075000","55636  >  443 [ACK] Seq=4076 Ack=125517 Win=128256 Len=0 TSval=613556010 TSecr=176845201"
"429","5.061923","10.150.33.220","104.81.18.27","TCP","66","0.000064000","55636  >  443 [ACK] Seq=4076 Ack=128285 Win=128256 Len=0 TSval=613556010 TSecr=176845201"
"434","5.062859","10.150.33.220","104.81.18.27","TCP","66","0.000083000","55636  >  443 [ACK] Seq=4076 Ack=131053 Win=128256 Len=0 TSval=613556011 TSecr=176845201"
"437","5.063000","10.150.33.220","104.81.18.27","TCP","66","0.000045000","55636  >  443 [ACK] Seq=4076 Ack=133821 Win=125504 Len=0 TSval=613556011 TSecr=176845201"
"438","5.063078","10.150.33.220","104.81.18.27","TCP","66","0.000121000","55636  >  443 [ACK] Seq=4076 Ack=135205 Win=131072 Len=0 TSval=613556011 TSecr=176845201"
"441","5.063383","10.150.33.220","104.81.18.27","TCP","66","0.000053000","55636  >  443 [ACK] Seq=4076 Ack=137229 Win=130432 Len=0 TSval=613556011 TSecr=176845201"
"444","5.063703","10.150.33.220","104.81.18.27","TCP","66","0.000048000","55636  >  443 [ACK] Seq=4076 Ack=138677 Win=129600 Len=0 TSval=613556011 TSecr=176845201"
"447","5.064046","10.150.33.220","104.81.18.27","TCP","66","0.000057000","55636  >  443 [ACK] Seq=4076 Ack=140125 Win=129600 Len=0 TSval=613556012 TSecr=176845201"
"455","5.068369","10.150.33.220","104.81.18.27","TCP","66","0.000285000","55636  >  443 [ACK] Seq=4076 Ack=141509 Win=131072 Len=0 TSval=613556016 TSecr=176845201"
"456","5.068426","10.150.33.220","104.81.18.27","TCP","66","0.000077000","55636  >  443 [ACK] Seq=4076 Ack=143021 Win=129536 Len=0 TSval=613556016 TSecr=176845201"
"457","5.068435","10.150.33.220","104.81.18.27","TCP","66","0.000083000","55636  >  443 [ACK] Seq=4076 Ack=145789 Win=126784 Len=0 TSval=613556016 TSecr=176845202"
"458","5.068435","10.150.33.220","104.81.18.27","TCP","66","0.000081000","55636  >  443 [ACK] Seq=4076 Ack=145917 Win=126656 Len=0 TSval=613556016 TSecr=176845202"
"462","5.070971","10.150.33.220","104.81.18.27","TCP","66","0.000088000","55636  >  443 [ACK] Seq=4076 Ack=147365 Win=129600 Len=0 TSval=613556018 TSecr=176845202"
"466","5.071095","10.150.33.220","104.81.18.27","TCP","66","0.000050000","55636  >  443 [ACK] Seq=4076 Ack=148813 Win=128128 Len=0 TSval=613556018 TSecr=176845202"
"467","5.071156","10.150.33.220","104.81.18.27","TCP","66","0.000111000","55636  >  443 [ACK] Seq=4076 Ack=150197 Win=131072 Len=0 TSval=613556018 TSecr=176845202"
"474","5.078695","10.150.33.220","104.81.18.27","TCP","66","0.000101000","55636  >  443 [ACK] Seq=4076 Ack=152965 Win=129664 Len=0 TSval=613556025 TSecr=176845202"
"475","5.078820","10.150.33.220","104.81.18.27","TCP","66","0.000217000","55636  >  443 [ACK] Seq=4076 Ack=154349 Win=131072 Len=0 TSval=613556025 TSecr=176845202"
"478","5.079932","10.150.33.220","104.81.18.27","TCP","66","0.000116000","55636  >  443 [ACK] Seq=4076 Ack=157117 Win=128256 Len=0 TSval=613556026 TSecr=176845202"
"482","5.081748","10.150.33.220","104.81.18.27","TCP","66","0.000063000","55636  >  443 [ACK] Seq=4076 Ack=159885 Win=129664 Len=0 TSval=613556027 TSecr=176845202"
"485","5.085920","10.150.33.220","104.81.18.27","TCP","66","0.000073000","55636  >  443 [ACK] Seq=4076 Ack=162653 Win=128256 Len=0 TSval=613556031 TSecr=176845202"
"489","5.086340","10.150.33.220","104.81.18.27","TCP","66","0.000065000","55636  >  443 [ACK] Seq=4076 Ack=165421 Win=125504 Len=0 TSval=613556031 TSecr=176845202"
"490","5.086340","10.150.33.220","104.81.18.27","TCP","66","0.000062000","55636  >  443 [ACK] Seq=4076 Ack=166189 Win=124736 Len=0 TSval=613556031 TSecr=176845203"
"494","5.086919","10.150.33.220","104.81.18.27","TCP","66","0.000055000","55636  >  443 [ACK] Seq=4076 Ack=168957 Win=121984 Len=0 TSval=613556032 TSecr=176845203"
"497","5.087063","10.150.33.220","104.81.18.27","TCP","66","0.000039000","55636  >  443 [ACK] Seq=4076 Ack=171725 Win=119232 Len=0 TSval=613556032 TSecr=176845203"
"498","5.087063","10.150.33.220","104.81.18.27","TCP","66","0.000037000","55636  >  443 [ACK] Seq=4076 Ack=171981 Win=118976 Len=0 TSval=613556032 TSecr=176845203"
"502","5.087494","10.150.33.220","104.81.18.27","TCP","66","0.000039000","55636  >  443 [ACK] Seq=4076 Ack=174749 Win=116160 Len=0 TSval=613556032 TSecr=176845203"
"503","5.087500","10.150.33.220","104.81.18.27","TCP","66","0.000042000","55636  >  443 [ACK] Seq=4076 Ack=174877 Win=116032 Len=0 TSval=613556032 TSecr=176845203"
"508","5.087761","172.217.24.238","10.150.33.220","TCP","66","0.010892000","443  >  55609 [ACK] Seq=1313 Ack=3605 Win=253 Len=0 TSval=176845203 TSecr=613556023"
"509","5.087825","10.150.33.220","104.81.18.27","TCP","66","0.000068000","55636  >  443 [ACK] Seq=4076 Ack=177645 Win=113280 Len=0 TSval=613556032 TSecr=176845203"
"510","5.087826","10.150.33.220","104.81.18.27","TCP","66","0.000068000","55636  >  443 [ACK] Seq=4076 Ack=177773 Win=113152 Len=0 TSval=613556032 TSecr=176845203"
"511","5.088181","10.150.33.220","104.81.18.27","TCP","66","0.000422000","55636  >  443 [ACK] Seq=4076 Ack=179157 Win=129152 Len=0 TSval=613556033 TSecr=176845203"
"515","5.089662","10.150.33.220","104.81.18.27","TCP","66","0.000121000","55636  >  443 [ACK] Seq=4076 Ack=181925 Win=128256 Len=0 TSval=613556034 TSecr=176845203"
"516","5.089799","10.150.33.220","104.81.18.27","TCP","66","0.000257000","55636  >  443 [ACK] Seq=4076 Ack=183309 Win=131072 Len=0 TSval=613556034 TSecr=176845203"
"519","5.090135","10.150.33.220","104.81.18.27","TCP","66","0.000054000","55636  >  443 [ACK] Seq=4076 Ack=186077 Win=129664 Len=0 TSval=613556034 TSecr=176845203"
"522","5.090417","10.150.33.220","104.81.18.27","TCP","66","0.000042000","55636  >  443 [ACK] Seq=4076 Ack=188845 Win=126912 Len=0 TSval=613556034 TSecr=176845204"
"526","5.093390","10.150.33.220","104.81.18.27","TCP","66","0.000064000","55636  >  443 [ACK] Seq=4076 Ack=191613 Win=128256 Len=0 TSval=613556037 TSecr=176845204"
"528","5.093834","10.150.33.220","104.81.18.27","TCP","66","0.000110000","55636  >  443 [ACK] Seq=4076 Ack=192997 Win=131072 Len=0 TSval=613556037 TSecr=176845204"
"532","5.093955","10.150.33.220","104.81.18.27","TCP","66","0.000051000","55636  >  443 [ACK] Seq=4076 Ack=195765 Win=128256 Len=0 TSval=613556037 TSecr=176845204"
"534","5.094142","10.150.33.220","104.81.18.27","TCP","66","0.000041000","55636  >  443 [ACK] Seq=4076 Ack=198533 Win=125504 Len=0 TSval=613556037 TSecr=176845204"
"536","5.094464","10.150.33.220","104.81.18.27","TCP","66","0.000158000","55636  >  443 [ACK] Seq=4076 Ack=199917 Win=131072 Len=0 TSval=613556038 TSecr=176845204"
"539","5.098759","10.150.33.220","104.81.18.27","TCP","66","0.000055000","55636  >  443 [ACK] Seq=4076 Ack=202685 Win=129664 Len=0 TSval=613556042 TSecr=176845205"
"544","5.099181","10.150.33.220","104.81.18.27","TCP","66","0.000056000","55636  >  443 [ACK] Seq=4076 Ack=205453 Win=128256 Len=0 TSval=613556042 TSecr=176845205"
"545","5.099181","10.150.33.220","104.81.18.27","TCP","66","0.000053000","55636  >  443 [ACK] Seq=4076 Ack=208221 Win=125504 Len=0 TSval=613556042 TSecr=176845205"
"547","5.100049","10.150.33.220","104.81.18.27","TCP","66","0.000685000","55636  >  443 [ACK] Seq=4076 Ack=209605 Win=131072 Len=0 TSval=613556043 TSecr=176845205"
"550","5.100561","10.150.33.220","104.81.18.27","TCP","66","0.000073000","55636  >  443 [ACK] Seq=4076 Ack=212373 Win=128256 Len=0 TSval=613556043 TSecr=176845205"
"553","5.101115","10.150.33.220","104.81.18.27","TCP","66","0.000060000","55636  >  443 [ACK] Seq=4076 Ack=215141 Win=125504 Len=0 TSval=613556044 TSecr=176845205"
"561","5.101580","10.150.33.220","104.81.18.27","TCP","66","0.000054000","55636  >  443 [ACK] Seq=4076 Ack=217909 Win=122752 Len=0 TSval=613556044 TSecr=176845205"
"562","5.101580","10.150.33.220","104.81.18.27","TCP","66","0.000050000","55636  >  443 [ACK] Seq=4076 Ack=220677 Win=120000 Len=0 TSval=613556044 TSecr=176845205"
"563","5.101592","10.150.33.220","104.81.18.27","TCP","66","0.000060000","55636  >  443 [ACK] Seq=4076 Ack=223445 Win=117184 Len=0 TSval=613556044 TSecr=176845205"
"564","5.102642","10.150.33.220","104.81.18.27","TCP","66","0.001109000","55636  >  443 [ACK] Seq=4076 Ack=224829 Win=131072 Len=0 TSval=613556045 TSecr=176845205"
"567","5.106902","10.150.33.220","104.81.18.27","TCP","66","0.000064000","55636  >  443 [ACK] Seq=4076 Ack=227597 Win=128256 Len=0 TSval=613556049 TSecr=176845205"
"571","5.107299","10.150.33.220","104.81.18.27","TCP","66","0.000039000","55636  >  443 [ACK] Seq=4076 Ack=230365 Win=128256 Len=0 TSval=613556049 TSecr=176845205"
"573","5.107624","10.150.33.220","104.81.18.27","TCP","66","0.000118000","55636  >  443 [ACK] Seq=4076 Ack=231749 Win=131072 Len=0 TSval=613556049 TSecr=176845205"
"576","5.107724","10.150.33.220","104.81.18.27","TCP","66","0.000035000","55636  >  443 [ACK] Seq=4076 Ack=234517 Win=128256 Len=0 TSval=613556049 TSecr=176845205"
"597","5.129212","10.150.33.220","104.81.18.27","TCP","66","0.000102000","55636  >  443 [ACK] Seq=4076 Ack=237285 Win=129664 Len=0 TSval=613556071 TSecr=176845205"
"598","5.129246","10.150.33.220","104.81.18.27","TCP","66","0.000129000","55636  >  443 [ACK] Seq=4076 Ack=240053 Win=126912 Len=0 TSval=613556071 TSecr=176845206"
"599","5.129246","10.150.33.220","104.81.18.27","TCP","66","0.000126000","55636  >  443 [ACK] Seq=4076 Ack=242821 Win=124096 Len=0 TSval=613556071 TSecr=176845206"
"600","5.129246","10.150.33.220","104.81.18.27","TCP","66","0.000123000","55636  >  443 [ACK] Seq=4076 Ack=245589 Win=121344 Len=0 TSval=613556071 TSecr=176845206"
"601","5.129246","10.150.33.220","104.81.18.27","TCP","66","0.000120000","55636  >  443 [ACK] Seq=4076 Ack=248357 Win=118592 Len=0 TSval=613556071 TSecr=176845206"
"602","5.129258","10.150.33.220","104.81.18.27","TCP","66","0.000129000","55636  >  443 [ACK] Seq=4076 Ack=251125 Win=115840 Len=0 TSval=613556071 TSecr=176845206"
"603","5.129261","10.150.33.220","104.81.18.27","TCP","66","0.000129000","55636  >  443 [ACK] Seq=4076 Ack=253893 Win=113024 Len=0 TSval=613556071 TSecr=176845206"
"604","5.129361","10.150.33.220","104.81.18.27","TCP","66","0.000227000","55636  >  443 [ACK] Seq=4076 Ack=256661 Win=110272 Len=0 TSval=613556071 TSecr=176845206"
"605","5.129361","10.150.33.220","104.81.18.27","TCP","66","0.000224000","55636  >  443 [ACK] Seq=4076 Ack=259429 Win=107520 Len=0 TSval=613556071 TSecr=176845206"
"606","5.129674","10.150.33.220","104.81.18.27","TCP","66","0.000536000","55636  >  443 [ACK] Seq=4076 Ack=260813 Win=123520 Len=0 TSval=613556071 TSecr=176845206"
"619","5.132255","10.150.33.220","104.81.18.27","TCP","66","0.000057000","55636  >  443 [ACK] Seq=4076 Ack=263581 Win=128256 Len=0 TSval=613556073 TSecr=176845206"
"620","5.132264","10.150.33.220","104.81.18.27","TCP","66","0.000062000","55636  >  443 [ACK] Seq=4076 Ack=266349 Win=125504 Len=0 TSval=613556073 TSecr=176845207"
"621","5.132267","10.150.33.220","104.81.18.27","TCP","66","0.000063000","55636  >  443 [ACK] Seq=4076 Ack=269117 Win=122752 Len=0 TSval=613556073 TSecr=176845207"
"622","5.132271","10.150.33.220","104.81.18.27","TCP","66","0.000064000","55636  >  443 [ACK] Seq=4076 Ack=271885 Win=120000 Len=0 TSval=613556073 TSecr=176845207"
"626","5.136139","10.150.33.220","104.81.18.27","TCP","66","0.000062000","55636  >  443 [ACK] Seq=4076 Ack=274653 Win=128256 Len=0 TSval=613556076 TSecr=176845209"
"630","5.136368","10.150.33.220","104.81.18.27","TCP","66","0.000034000","55636  >  443 [ACK] Seq=4076 Ack=277421 Win=128256 Len=0 TSval=613556076 TSecr=176845209"
"633","5.136954","10.150.33.220","104.81.18.27","TCP","66","0.000035000","55636  >  443 [ACK] Seq=4076 Ack=280189 Win=125504 Len=0 TSval=613556076 TSecr=176845209"
"637","5.137410","10.150.33.220","104.81.18.27","TCP","66","0.000047000","55636  >  443 [ACK] Seq=4076 Ack=282957 Win=129664 Len=0 TSval=613556077 TSecr=176845209"
"639","5.137616","10.150.33.220","104.81.18.27","TCP","66","0.000066000","55636  >  443 [ACK] Seq=4076 Ack=284341 Win=131072 Len=0 TSval=613556077 TSecr=176845209"
"642","5.145428","10.150.33.220","104.81.18.27","TCP","66","0.000050000","55636  >  443 [ACK] Seq=4076 Ack=287109 Win=128256 Len=0 TSval=613556085 TSecr=176845209"
"646","5.145854","10.150.33.220","104.81.18.27","TCP","66","0.000044000","55636  >  443 [ACK] Seq=4076 Ack=289877 Win=129664 Len=0 TSval=613556085 TSecr=176845209"
"650","5.146128","10.150.33.220","104.81.18.27","TCP","66","0.000070000","55636  >  443 [ACK] Seq=4076 Ack=292645 Win=126912 Len=0 TSval=613556085 TSecr=176845209"
"652","5.146246","10.150.33.220","104.81.18.27","TCP","66","0.000024000","55636  >  443 [ACK] Seq=4076 Ack=295413 Win=124096 Len=0 TSval=613556085 TSecr=176845209"
"655","5.146936","10.150.33.220","104.81.18.27","TCP","66","0.000043000","55636  >  443 [ACK] Seq=4076 Ack=298181 Win=121344 Len=0 TSval=613556086 TSecr=176845209"
"658","5.147344","10.150.33.220","104.81.18.27","TCP","66","0.000029000","55636  >  443 [ACK] Seq=4076 Ack=300949 Win=118592 Len=0 TSval=613556086 TSecr=176845209"
"661","5.147776","10.150.33.220","104.81.18.27","TCP","66","0.000041000","55636  >  443 [ACK] Seq=4076 Ack=303717 Win=115840 Len=0 TSval=613556087 TSecr=176845209"
"663","5.148063","10.150.33.220","104.81.18.27","TCP","66","0.000146000","55636  >  443 [ACK] Seq=4076 Ack=305101 Win=131072 Len=0 TSval=613556087 TSecr=176845209"
"668","5.148465","10.150.33.220","104.81.18.27","TCP","66","0.000069000","55636  >  443 [ACK] Seq=4076 Ack=307869 Win=129664 Len=0 TSval=613556087 TSecr=176845209"
"669","5.148465","10.150.33.220","104.81.18.27","TCP","66","0.000063000","55636  >  443 [ACK] Seq=4076 Ack=310637 Win=126912 Len=0 TSval=613556087 TSecr=176845209"
"671","5.149737","10.150.33.220","104.81.18.27","TCP","66","0.001085000","55636  >  443 [ACK] Seq=4076 Ack=312021 Win=131072 Len=0 TSval=613556089 TSecr=176845209"
"674","5.151032","10.150.33.220","104.81.18.27","TCP","66","0.000114000","55636  >  443 [ACK] Seq=4076 Ack=314789 Win=128256 Len=0 TSval=613556090 TSecr=176845210"
"677","5.151344","10.150.33.220","104.81.18.27","TCP","66","0.000047000","55636  >  443 [ACK] Seq=4076 Ack=317557 Win=125504 Len=0 TSval=613556090 TSecr=176845210"
"679","5.151775","10.150.33.220","104.81.18.27","TCP","66","0.000067000","55636  >  443 [ACK] Seq=4076 Ack=318941 Win=124096 Len=0 TSval=613556090 TSecr=176845210"
"683","5.152168","10.150.33.220","104.81.18.27","TCP","66","0.000046000","55636  >  443 [ACK] Seq=4076 Ack=321709 Win=129664 Len=0 TSval=613556091 TSecr=176845210"
"686","5.152578","10.150.33.220","104.81.18.27","TCP","66","0.000032000","55636  >  443 [ACK] Seq=4076 Ack=324477 Win=126912 Len=0 TSval=613556091 TSecr=176845210"
"689","5.157434","10.150.33.220","104.81.18.27","TCP","66","0.000057000","55636  >  443 [ACK] Seq=4076 Ack=327245 Win=124096 Len=0 TSval=613556096 TSecr=176845210"
"695","5.157959","10.150.33.220","104.81.18.27","TCP","66","0.000063000","55636  >  443 [ACK] Seq=4076 Ack=330013 Win=121344 Len=0 TSval=613556096 TSecr=176845211"
"696","5.157960","10.150.33.220","104.81.18.27","TCP","66","0.000059000","55636  >  443 [ACK] Seq=4076 Ack=332781 Win=118592 Len=0 TSval=613556096 TSecr=176845211"
"698","5.158281","10.150.33.220","104.81.18.27","TCP","66","0.000054000","55636  >  443 [ACK] Seq=4076 Ack=335549 Win=115840 Len=0 TSval=613556097 TSecr=176845211"
"701","5.160194","10.150.33.220","104.81.18.27","TCP","66","0.000061000","55636  >  443 [ACK] Seq=4076 Ack=338317 Win=113024 Len=0 TSval=613556098 TSecr=176845211"
"705","5.160638","10.150.33.220","104.81.18.27","TCP","66","0.000068000","55636  >  443 [ACK] Seq=4076 Ack=341085 Win=110272 Len=0 TSval=613556098 TSecr=176845211"
"707","5.160861","10.150.33.220","104.81.18.27","TCP","66","0.000079000","55636  >  443 [ACK] Seq=4076 Ack=343853 Win=107520 Len=0 TSval=613556098 TSecr=176845211"
"716","5.161123","10.150.33.220","104.81.18.27","TCP","66","0.000077000","55636  >  443 [ACK] Seq=4076 Ack=346621 Win=104768 Len=0 TSval=613556099 TSecr=176845211"
"717","5.161124","10.150.33.220","104.81.18.27","TCP","66","0.000074000","55636  >  443 [ACK] Seq=4076 Ack=349389 Win=101952 Len=0 TSval=613556099 TSecr=176845211"
"718","5.161140","10.150.33.220","104.81.18.27","TCP","66","0.000087000","55636  >  443 [ACK] Seq=4076 Ack=352157 Win=99200 Len=0 TSval=613556099 TSecr=176845211"
"719","5.161140","10.150.33.220","104.81.18.27","TCP","66","0.000083000","55636  >  443 [ACK] Seq=4076 Ack=354925 Win=96448 Len=0 TSval=613556099 TSecr=176845211"
"722","5.161456","10.150.33.220","104.81.18.27","TCP","66","0.000046000","55636  >  443 [ACK] Seq=4076 Ack=357693 Win=93696 Len=0 TSval=613556099 TSecr=176845211"
